Domain	Source Sentence	Reference Translation	Google Translate	Yandex Translate
twitter	በኢትዮጵያ ውስጥ ህዝቡ ፔፕሲ እንዳይጠጣ ተጠየቀ http://revolutionfordemocracy.com/2016/02/08/%e1%89%a0%e1%8a%a2%e1%89%b5%e1%8b%ae%e1%8c%b5%e1%8b%ab-%e1%8b%8d%e1%88%b5%e1%8c%a5-%e1%88%85%e1%8b%9d%e1%89%a1-%e1%8d%94%e1%8d%95%e1%88%b2-%e1%8a%a5%e1%8a%95%e1%8b%b3%e1%8b%ad%e1%8c%a0%e1%8c%a3/ …pic.twitter.com/9GB6M1XXk9	In Ethiopia, the public was asked not t drink Pepsi. http://revolutionfordemocracy.com/2016/02/08/%e1%89%a0%e1%8a%a2%e1%89%b5%e1%8b%ae%e1%8c%b5%e1%8b%ab-%e1%8b%8d%e1%88%b5%e1%8c%a5-%e1%88%85%e1%8b%9d%e1%89%a1-%e1%8d%94%e1%8d%95%e1%88%b2-%e1%8a%a5%e1%8a%95%e1%8b%b3%e1%8b%ad%e1%8c%a0%e1%8c%a3/ …pic.twitter.com/9GB6M1XXk9	Public asked to drink Pepsi in Ethiopia http://revolutionfordemocracy.com/2016/02/08/%e1%89%a0%e1%8a%a2%e1%89%b5%e1%8b%ae%e1%8c%b5 % e1% 8b% ab-% e1% 8b% 8d% e1% 88% b5% e1% 8c% a5-% e1% 88% 85% e1% 8b% 9d% e1% 89% a1-% e1% 8d% 94% e1% 8d% 95% e1% 88% b2-% e1% 8a% a5% e1% 8a% 95% e1% 8b% b3% e1% 8b% ad% e1% 8c% a0% e1% 8c% a3 /… Pic.twitter.com / 9GB6M1XXk9	The people in the pension in the animal http://revolutionfordemocracy.com/2016/02/08/%e1%89%a0%e1%8a%a2%e1%89%b5%e1%8b%ae%e1%8c%b5%e1%8b%ab-%e1%8b%8d%e1%88%b5%e1%8c%a5-%e1%88%85%e1%8b%9d%e1%89%a1-%e1%8d%94%e1%8d%95%e1%88%b2-%e1%8a%a5%e1%8a%95%e1%8b%b3%e1%8b%ad%e1%8c%a0%e1%8c%a3/ ...pic.twitter.com/9GB6M1XXk9
twitter	Artist Zinah Bizu got a baby: Ethiopika Link {አርቲስት ዝና ብዙ አይኑን በአይኑ አየ ፣ ኮካ ኮላ በኢትዮጵያ http://entertainment.welkessa.com/?p=3702 pic.twitter.com/qiAJoJbs31	Artist Zinah Bizu got a baby: Ethiopika Link {Artist Zinah Bizu got a baby, Coca Cola Ethiopia http://entertainment.welkessa.com/?p=3702 pic.twitter.com/pbhBXRBX1z	Artist Zinah Bizu got a baby: Ethiopiaika Link {Artist&#39;s fame in his eyes, Coca Cola in Ethiopia http://entertainment.welkessa.com/?p=3702 pic.twitter.com/qiAJoJbs31	Zinah Bizu got a baby Artist: Ethiopika Link {CF ይኑር ይኑር the popularity of the many weather , products or Ethiopia http://entertainment.welkessa.com/?p=3702 pic.twitter.com/qiAJoJbs31
twitter	"በ2ኛው የኮካ ኮላ 7 ኪ.ሜ የጎዳና ላይ ውድድር ጋዲሳ ብርሀኑ እና ዘውድነሽ አየለ አሸነፉ ""ታላቁ ሩጫ በኢትዮጵያ ከኮካ ኮላ ጋር በመተባበር ዘንድሮ ለአራተኛ ግዜ የሚያካሂደው... http://fb.me/268tj73iN"	"On the 2nd Coca Cola 7 K.M competition, Gadisa Berhanu and Zewdenesh Ayale have won ""The Ethiopian Great Run presenting the 4th time in coorporation with Cocal Cola … http://fb.me/268tj73iN"	&quot;In the second Coca Cola 7km road race, Garissa Berhanu and Zedhenesh Abele won the fourth race to be held in collaboration with Coca-Cola in Ethiopia. Http://fb.me/268tj73iN&quot;	"The cola or 7 began.Amen street light and IT governance the Swedish government has አሸነፉም ""the great race or the time in the choke... has renewed its themakamers http://fb.me/268tj73iN"
twitter	ኑሮ ካሉት ፍሪጅም ይሞቃል አለች ኮካ ኮላ ‹‹በኢትዮጵያ በህይወት የመቆያ እድሜ ከ45 ወደ 64 ከፍ አለ›› http://www.fanabc.com/index.php?option=com_content&view=article&id=8965:----45--64--&catid=102:slidehttp://www.fanabc.com/index.php?option=com_content&view=article&id=8965:----45--64--&catid=102:slide …	If you call it a life the Refrigerator can be hot said Coca Cola << The life span has increased from 45 to 64>> http://www.fanabc.com/index.php?option=com_content&view=article&id=8965:----45--64--&catid=102:slidehttp://www.fanabc.com/index.php?option=com_content&view=article&id=8965:----45--64--&catid=102:slide …	Coca-Cola: Warm-Up in Life - &amp; catid = 102: slidehttp: //www.fanabc.com/index.php? option = com_content &amp; view = article &amp; id = 8965: ---- 45--64 - &amp; catid = 102: slide ...	She said one of the products or in collaboration with aaccsa AI from ""life in the age 45 and 64 said Flora"" http://www.fanabc.com/index.php?option=com_content&view=article&id=8965:----45--64--&catid=102:slidehttp://www.fanabc.com/index.php?option=com_content&view=article&id=8965:----45--64--&catid=102:slide ...
twitter	"ጌታነህ ሞላ እና ሽቶ ውዴሳ የ2014 የኮካ-ኮላ ተከታታይ ሩጫ የመጀመሪያ ውድድር አሸናፊ ሆኑ ""ታላቁ ሩጫ በኢትዮጵያ ከኮካ-ኮላ ጋር በመተባበር ለአራተኛ ግዜ የሚያካሂደው የ7... http://fb.me/1dBkDHMgA"	"Getaneh Mola and Sheto Wedase have won the 2014 Coca Cola running series. ""The Ethiopian Great Run presenting the 4th time in coorporation with Cocal Cola 7 ... http://fb.me/1dBkDHMgA"	&quot;Getaneh Molla and perfume win the 2014 Coca-Cola Series race&quot;	"Cocoa and filled with stone 2014 means idea-the first race in the series is noble, or that ""a great race in Coca-7 or the time to themakamers has renewed its... http://fb.me/1dBkDHMgA"
twitter	የኮካ ኮላ የጎዳና ሩጫ በኢትዮጵያ ይህንን ይመስላል። የዘንድሮውን ለመሮጥ ተዘጋጅታችኋል? | EthioTube Sports Presents Highlights of Coca Cola Road... http://fb.me/2YFYsbznN	Here it looks Coca Cola's Road Run in Ethiopia. Are your readt to run this years race? | EthioTube Sports Presents Highlights of Coca Cola Road... http://fb.me/2YFYsbznN	This is what Coca-Cola&#39;s street racing is like in Ethiopia. Are you ready to run the race? | EthioTube Sports Presents Highlights of Coca Cola Road ... http://fb.me/2YFYsbznN	This seems to be in the street or cocoa. The country is in the thematical smart? | Coca Cola Presents Highlights of Road EthioTube Sports... http://fb.me/2YFYsbznN
twitter	"4ኛው የኮካ ኮላ 7ኪ.ሜ ተከታታይ የጎዳና ላይ ሩጫ ምዝገባ ተጀመረ ""ታላቁ ሩጫ በኢትዮጵያ ከኮካ ኮላ ጋር በመተባበር ከሶስት ዓመት በፊት የጀመረው ይህ ውድድር ሁሉም ተሳታፊዎች... http://fb.me/10V1nqIxC"	"The registration for the 4th Coca Cola's 7 K.M Series road race has began "" The Ethiopian Great Run in partrneship with Coca Cola that has began before three years, every participant …http://fb.me/10V1nqIxC"	Registration for the 4th Coca Cola 7km series of road racing started	"4 I or COLA.If a series of race registration begins Amen ""the great race three years ago in the Coke or to all the participants began this... http://fb.me/10V1nqIxC"
twitter	ኮካ ኮላ ኩባንያ ኢትዮጵያ ውስጥ ተጨማሪ ኢንቨስትመንት ሊያካሂድ ነው አዲስ አበባ ፣ የካቲት 20 ፣ 2006 (ኤፍ.ቢ.ሲ.) ኮካ ኮላ ኩባንያ በኢትዮጵያ የተለያዩ ክልሎች ተጨማሪ... http://fb.me/6mhDQ6RLy	Coca Cola Company is investing more in Ethiopia: Addis Ababa, February 20, 2006 (FBC) Coca Cola Company in Ethiopia different states… http://fb.me/6mhDQ6RLy	Coca-Cola Company to Invest in Ethiopia	The more products or placed in the company of Ethiopia, Addis Ababa, February 20 , 2006 (VIII.The.C.) Company products or in different regions... more http://fb.me/6mhDQ6RLy
twitter	ኡፍፍፍ ኧረ ኮካ ኮላ በዚህ ብርድ ያ አቤት ሙቀት አቤት ፀሀይ እያለ አዝግ ቀልድ የሚቀልደውን ማስታወቂያቹን ዞር አርጉልን #CocaCola #ethiopia	Ahhhh, Please Coca Cola, please put this ad out of my face that says this hot weather, this sun with this cold weather. #CocaCola #ethiopia	UFFFO Coca Cola With this chilling hot weather	Ufff that are the products or the warm sun in this card are turned huh arguing mastering a flickerdown #CocaCola #ethiopia
twitter	ፊፋ በየወሩ የሚወጣው የኮካ ኮላ የሃገራት ደረጃ ዛሬ ከሰዓታት በፊት ይፋ ተደርጓል @footballethiop @JuneidiBashahttp://www.soccerethiopia.net/football/36297	FIFA announced the monthly Coca-Cola Countries ranking ago hours before today afternoon. @footballethiop @JuneidiBashahttp: //www.soccerethiopia.net/football/36297	FIFA announced the monthly Coca-Cola Country Countries hours ago today @footballethiop @JuneidiBashahttp: //www.soccerethiopia.net/football/36297	Each month the conference is the COLA for today or have the hours ago for Africa. @footballethiop @JuneidiBashahttp://www.soccerethiopia.net/football/36297
twitter	"ሺሻ ቤት ገብተህ ""hookah"" ብለህ አዘህ Coca-Cola የመጣልህ ልጅ ፈጣሪ ነብስህን እንዲምር እፀልያለሁ! @henoksolomon"	"Getting to a Shisha lounge and ordered ""hookah"", I pray to that kid to lead his soulvwho brought you Coca-Cola! @henoksolomon"	I ordered &quot;hookah at home&quot; &quot;hookah&quot; &quot;I pray that the kid who threw Coca-Cola will let you have your soul! @Henoksolomon&quot;	"The site quotes ""hookah"" you aces Coca-Cola has come to I pray that the creator of the noise to be literate! @henoksolomon"
twitter	(A-1)(GJ-1) (A-05), etc,..., Ethiopia 010 -PEPSI CRYSTAL !..የወደቁት መላዕክት የታሠሩበትን የዐልማዝ ወህኒ ቤት የመክፈት የመጨረሻ ስራዎች.. - YouTube.html https://www.youtube.com/attribution_link?a=HPDP0qwOXIA&u=%2Fwatch%3Fv%3DJm0ZmF-7LCc%26feature%3Dshare …	(A-1)(GJ-1) (A-05), etc,..., Ethiopia 010 -PEPSI CRYSTAL !.. The last work to open the almaz prison which the fallen angels were prisoned .. - YouTube.html https://www.youtube.com/attribution_link?a=HPDP0qwOXIA&u=%2Fwatch%3Fv%3DJm0ZmF-7LCc%26feature%3Dshare …	(A-1) (GJ-1) (A-05), etc, ..., Ethiopia 010 -PEPSI CRYSTAL! .. Final Works of Opening the Diamond Prison, where the fallen angels are bound - YouTube.html https: // www. .youtube.com / attribution_link? a = HPDP0qwOXIA &amp; u =% 2Fwatch% 3Fv% 3DJm0ZmF-7LCc% 26feature% 3Dshare…	(A-1)(GJ-1) (A-05), etc,..., Ethiopia 010 -CRYSTAL PEPSI !..The guest planet flash unit transruptions of last evening.. - YouTube.html https://www.youtube.com/attribution_link?a=HPDP0qwOXIA&u=%2Fwatch%3Fv%3DJm0ZmF-7LCc%26feature%3Dshare ...
twitter	"ፖታቶን ፖቴቶን በቺፕስ ( ፍሪቶ ሌይስ ? ዶሪቶሰ?) ባለመብት ከሆነ ፦ በትሮፒካና ኦሬንጅ ጁይስ ""ብርቱካንን"" በፒዛ ሃት ደግሞ "" ስንዴንና ላምንም"" ፔፕሲ የኔ ነው ይላል። የኔዘርላንዱ ዶ/ርስ ጤፍ የኔ ነው ብሎ እንዳለ ሠምተሀል?"	Potato Potato chips(freto, lays. Doritos?) are the ones who have legal right, By tropical orange juice pizza hut is saying Orange belongs to them why not pepsi says wheat and cows are mine. Have you heard that the netherlands doctor said that Eragrostis tef is theirs?	&quot;If you own the Potato Potato with Chips (Frito Leis? Doritos?): In Tropicana Orange Juice&quot; &quot;Orange&quot; &quot;On Pizza Hut,&quot; &quot;Pepsi belongs to me.	"This potatoes potatoes ( less first ? Write?) The right to : Petrosyan orange juice ""orange and"" in spite such as Red Hat "" of mine"" and says of the pension. Netherlands icon/small of the and is that that?"
twitter	@DeBirhaner ብቻ? must be on sale, couldn't compete with Alamudi pepsi? lol	Only @DeBirhaner? must be on sale, couldn't compete with Alamudi pepsi? lol	@DeBirhaner ብቻ? must be on sale, couldn't compete with Alamudi pepsi? lol	@DeBirhaner only? must be on sale, couldn't compete with pepsi Alamudi? lol
twitter	እውነቱ ግን ኮካም ይሁን ፔፕሲ ብዙ የጤና ችግር ማምጣታቸው ነው፣Coke and Pepsi concede that maybe soda is bad for you http://wapo.st/1uWCZO5 via @washingtonpost	Its true that both coca and pepsi will have health problem፣Coke and Pepsi concede that maybe soda is bad for you http://wapo.st/1uWCZO5 via @washingtonpost	But the truth is Coca and Pepsi have a lot of health problems, Coke and Pepsi concede that maybe soda is bad for you http://wapo.st/1uWCZO5 via @washingtonpost	But in fact, many of the health of the pension program will come however,Coke and Pepsi concede that maybe soda is bad for you http://wapo.st/1uWCZO5 via @washingtonpost
twitter	እኔም አመለጥኩ... በመካኒሳ ሸወድኩት... በገብርኤል አድርገህ ፔፕሲ ያስወጣል... ያግን ሊሰሩት መንገዱን አበላሽተውት ነበር	I escaped, I went by mekanisa and on the way to gebriel there is a road to Pepsi… But for that one they damaged the road because they were on construction.	I missed it ... I fell in love with Macanisa ... took out Pepsi in Gabriel ... they ruined the way for him to help	Amleto, and I shall be......... balcanica herdict before the pension list was get adblaster Ireland
twitter	#Ethiopia ጀግኖቹን አይቻቼው መጣሁ (አሌክስ ሸገር) ቄራ ፔፕሲ በሚገኘው ግዜያዊ ማቆያ ጣቢያ ስደርስ በመጀመሪያ ያገኘኃቸው ማሂና ወይንሸትን ነበር የወጣትነት ግዜዋን ለሃገር እና ለወገን ፍቅር እየገበረች ያለችው ማሂ http://www.ethioreference.com/archives/10511 pic.twitter.com/o1v79wQcry	#Ethiopia I saw the brave ones (Alex Sheger) When I first went to temporary preservation station in kera pepsi I saw mahi and woineshet, Mahi sacrificed her youth age for the love of pepole and country http://www.ethioreference.com/archives/10511 pic.twitter.com/o1v79wQcry	#Ethiopia I saw the heroes (Alex Sheger) When I arrived at the temporary detention center in Kappa Pepsi, the first thing they saw was Mahinna Watersh, who was developing her love for country and family at http://www.ethioreference.com/archives/10511 pic.twitter.com/o1v79wQcry	#Ethiopia from IEEE Gagnon (her Alex) waiting your Great shares in the pension nervosa agenerase Everatt was the first main of the country and wants the love of many green aligators http://www.ethioreference.com/archives/10511 pic.twitter.com/o1v79wQcry
twitter	@riselovelive :))ፔፕሲ ደስ ይላል:) እቃቃ ወሳኝ ቤተሰባዊ መተሳሰብ ያለበት:) ግን አንቺ ሁሌ ሙሽራ የምትሆኚዉ እንክብካቤ ስለምትወጂ ነዉ ወይስ ስራ ስለማትወጂ?:)እኔ ደሞ ሁሌ ከአንድ ልጅ ጋር እጋባ ነበር:	@riselovelive :))Pepsi is fun:) Have a very strong supporting family relation:) But why is the reason you always like to be the bride? Is it because you like care or is it because your lazy:)i would only get married with only one person.	@riselovelive :)) Pepsi is fun :) The item is a must-have family concern :) But do you always care for a bride or not for work? :) I&#39;ve always been married to a girl:	@riselovelive :))says the pension:) it must be crucial familial imitate Ankara:) but you always care more in formation or work formation imethod?:)I was always one of the area managers and employees to:
twitter	@burawD @Ashe_Q @fisseha505 ልክ ነህ አባዬ፡፡ “ደርባን” እና “ፔፕሲ” የሳንጆርጅ ማሊያ ላይ ስፖንሰሮች ናቸው፡፡ባለፈው አመት ለካፍ ውድድር ክንድ ላይ ያለውን የ“ፔፕሲን” አርማ ካፍ አሰቀንሶት ነበር….	@burawD @Ashe_Q @fisseha505 you are right dad. “Derban” and “Pepsi” are the sponsors of St,georgis kit. Last year for matches under CAF, It removed the Pepsi’s logo that was on the arms	@burawD @Ashe_Q @ fisseha505 You&#39;re right Dad. “Durban” and “Pepsi” are sponsors of the Sanjay Mall.	@burawD @Ashe_Q @fisseha505 dad as you are   “and plans” and “pension” are sponsors for the Asia Shangri  his arm in the past year in the location of the“pension” was the asset have Logo....
twitter	@_Bisre @StGeorgeFCFans @Ashe_Q @fisseha505 @fikaleb እሱ ይሻል ነበር፣ its #CAF 's Logo on Saladin & #Pepsi on Bahailu ... lol	@_Bisre @StGeorgeFCFans @Ashe_Q @fisseha505 @fikaleb It was better፣ its #CAF 's Logo on Saladin & #Pepsi on Bahailu ... lol	@_Bisre @StGeorgeFCFans @Ashe_Q @fisseha505 @fikaleb እሱ ይሻል ነበር፣ its #CAF 's Logo on Saladin & #Pepsi on Bahailu ... lol	@_Bisre @StGeorgeFCFans @Ashe_Q @fisseha505 @fikaleb was he wants to, its #CAF's Logo on Saladin & #Bahailu on Pepsi ... lol
twitter	"New finding: (ባይዘዌ ትናንት ማታ የተገለጠልኝ ነው) ""የውስኪ ሞለኪውል ሲለጠጥ ፔፕሲ ይሆናል።"""	New finding: (By the way its something I realized yesterday) if the molecules of whiskey is extended it will be Pepsi.	&quot;New finding: (Bawaway was unveiled to me last night)&quot; &quot;When the whiskey molecule is posted, it will be pepsy.&quot; &quot;	"New finding: (yesterday night they have from creation of battery) ""pension molehill just be silent."""
twitter	በስልኮቻችሁ እንደዚህ አይነት መልእክቶች እንዳያታልሏችሁ ጠንቀቅ በሉ ለማለት ነው Your mobile number has won you 850,000.00 Dollars in 2019 PEPSI ANNIVERSARY DRAW IN USA,to claim,send your Name,Address & Mobile# to: pepsipa@outlook.com	It is to warn you not get scammed by messages like this Your mobile number has won you 850,000.00 Dollars in 2019 PEPSI ANNIVERSARY DRAW IN USA,to claim,send your Name,Address & Mobile# to: pepsipa@outlook.com	To avoid sending messages like this on your phone, please be careful that your mobile number has won you 850,000.00 Dollars in 2019 PEPSI ANNIVERSARY DRAW IN USA, to claim, send your Name, Address &amp; Mobile # to: pepsipa@outlook.com	Andalou baseless messages such allowance i.e. there Your mobile number has won 850,000 of you.PEPSI ANNIVERSARY IN 2019 00 DRAW Dollars in USA,to claim,send your Name,Address & Mobile# to: pepsipa@outlook.com
twitter	@lulualeb i know፡) @eyobbalcha @fissehaf @haileyabekele @maedi_k @miamen20152 ይሄ ነው እንጂ ኮካ ኮካ እያለ ልቤን የሚያደርቃት፡)@total_433	@lulualeb i know፡) @eyobbalcha @fissehaf @haileyabekele @maedi_k @miamen20152 This here is annoying me by asking Coca Coca.	@lulualeb i know) @eyobbalcha @fissehaf @haileyabekele @maedi_k @ miamen20152 This is it, but what makes my heart so coca-coca) @ total_433	@lulualeb i know ) @eyobbalcha @fissehaf @haileyabekele @maedi_k @miamen20152 of my heart, but this is a immeadiate products products )@total_433
twitter	@effooy ኮካ እንኳንስ ስኳር አግኝቶ እንዲሁም ግንፍልኮ ነው። :-)	@effooy Let alone with sugar, Coca already fizzes. :-)	@effooy Cocaine has found sugar and is also a smoker. :-)	@effooy formal and generic products of the corporation, even if. :-)
twitter	@BabeeMesh > @Michot_G ኮካ ነው እንዴ? :)	@BabeeMesh > @Michot_G Is that Coca? :)	@BabeeMesh&gt; @Michot_G Is it coca? :)	@BabeeMesh > @Michot_G one of the products? :)
twitter	እኛ ዝም ብለን ተንጫጫን እንጊ ኮካ ኮላ ቴዲን ትቶ እራሱን እንጺ እያስተዋወቀ ነው !!! ፈገጎታ ያንሳል !!! http://fb.me/6IodySsYb	We are just screaming but Coca-Cola is promoting itself without Teddy!!! Fun please!!! http://fb.me/6IodySsYb	We just shook our head and left him Coca Cola Teddy !!! Slower !!! http://fb.me/6IodySsYb	And that any products or to the Tonkawa elastomer and any of the testing himself !!! Is less than forgot !!! http://fb.me/6IodySsYb
twitter	ይህ ከዚህ በታች የምታገኙት ፅሁፍ ስለ የዓለም ዋንጫ የኢትዮጵያው ቅጂ ሙዚቃ ከቴዲ አፍሮ የተላከ መግለጫ ነው። ባለፉት ወራቶች ቴዎድሮስ ካሳሁን ወይም “ቴዲ አፍሮ” ከኮካ ኮላ... http://fb.me/2FdpKok3B	The post below is from Teddy Afro about the World Cup with Ethiopican Music. In the last months Tewodros Kassahun or "Teddy Afro" with Coca-Cola ... http://fb.me/2FdpKok3B	Here is an excerpt from Teddy Afro&#39;s article about the Ethiopian version of the World Cup. In the past months, Theodros Kanyama or &quot;Teddy Afro&quot; from Coca Cola ... http://fb.me/2FdpKok3B	This is when you will enjoy the Africa Cup of Nations about the world below the text are a copy of the statement sent by cited music. In the past warts, or indemnity Ethiopia “are the” Coke or... http://fb.me/2FdpKok3B
twitter	@Haftomb @TeddyAfroMusic ነይ ማነሽ እስቲ ኮካ ድገሚኝ ኡፍፍፍፍፍፍፍፍ እንዲህ ነው እንጂ ቆሽት ማድበን እሰይይይይይይ	@Haftomb @TeddyAfroMusic Teddy Afro Music Ney manesh, uffff one more Coca please yessssss	@Haftomb @TeddyAfroMusic Come on!	@Haftomb @TeddyAfroMusic a segment of said yes, but let me don't trust products made upperfilters እሰይይይይይይ
twitter	የምንይልክ ያለህ በ97 የሼኩን ፔፕሲ አቁመን ወደ ኮካ ፡ አሁን ደግሞ ኮካ ፤ ወይ አበሳ። ኦፕ ኦፕ መበጥበጥ ነው እንግዲህ። መቼም እሱም የቴድሮስ አፍሮን ኮንሰርት ሰርዞ... http://fb.me/32S7HTyqq	Ow Minilik In 97 Pepsi's turns to Coca, Today Coca, oww shit. Let mix Opop. May be he cancelled Tewodros Afro's concert ... http://fb.me/32S7HTyqq	What we have to say is that we stopped at Chechen Pepsi in 97 and now go to Coca, or Coca. Open-up is a mess. He never canceled the Tedros Afron concert ... http://fb.me/32S7HTyqq	If you have a pension than to become products imminence 97   products now also : daily reminder that I, or abuse. Therefore member of the open open. Concerts are servo testers that it will never... http://fb.me/32S7HTyqq
twitter	@CocaCola ደስታ ለኔ ጊዜዬን ከሴት ጓደኞቼ ጋር ማሳልፍ ነው! ከተስማሙ ይውደዱት!	@CocaCola happines for me is to be with Girls! If you agree like it!	@CocaCola Fun is for me to spend time with my girlfriends! Love it if you agree!	@CocaCola happiness of myself to a woman, given for me my friends! Louder if you agree!
twitter	@TameZKafir @Mahlet_S ኮካ ኮላስ ቢሆን ሙሉ የምስራቅ አፍሪካ ገበያውን ነው የሚያጣው፣ እንዴት ለአለም ዋንጫ የቴዲ አይነት ነፍጠኛ እንዲዘፍን ይመርጣል ? ፡)	@TameZKafir @Mahlet_S Coca-Cola will lose its customers in East africa. How does it select a singer like Teddy Afro for world cup? :)	If @TameZKafir @Mahlet_S If Coca Cola loses the whole East African market, how does he choose to dance Teddy&#39;s soul to the World Cup? )	@TameZKafir of Police products in the class of full imitate eastern Africa, Africa Cup of nations how the world Anderson the American Neptune type ?  )
twitter	@burawD @Ashe_Q @fisseha505 እይታህ ይገርማል፡፡ሳላ የአምናውን የካፍ ውድድር ማሊያ እና ቱሳ ደግሞ የሊጉንና ዋናውን Pepsi ስፖንሰር የሆነውን ነው የለበሱት eyes open & hope won’t happen	@burawD @Ashe_Q @fisseha505 your view is amazing. Sala wears last year CAF competition uniform and Tusa wears uniform sponsored by pepsi. eyes open & hope won’t happen	@burawD @Ashe_Q @ fisseha505 Your view will be amazing.	@burawD @Ashe_Q @እይታህ fisseha505 year  the care and Salah lived Kamau Asia and also the use of the Pepsi sponsored the original albeit that the eyes open & hope won’t happen
twitter	ከሚያስጠላኝ የማስታወቂያ ዓይነት ውስጥ አንዱ '' …ተወዳጅ ሰው አፍሪካዊ ነው…ዓለም ስለመጪው ጊዜ ሲጨነቅ 1 ቢሊዮን አፍሪካዊያን ኮካ ኮላ ይጠጣሉ'' ድንቄም ኮካ አለች ቢዮንሴ በአማርኛ ስትተርት!	One of the abominate advert "the famous man is African . . . When the world fall in stress 1 billion African's drink Coca Cola" said Dinqe Coca when Beyonce says in Amharic!	One of the types of advertising that haunts me is &#39;&#39;… the favorite person is African ... 1 billion Africans drink Coca Cola when the world worries about the future &#39;&#39;.	In one type of hemiacetals ID " ...man your favorite...seeing the world in the selection of products or the African tell 1 billion," she said Diegem BIOS English start products!
twitter	ኮፓ ኮካ ኮላ ሐገር አቀፍ ውድድር ዛሬ ተጠናቋል http://www.soccerethiopia.net/football/39489	Copa Coca-Cola national competition is ended today http://www.soccerethiopia.net/football/39489	The Copa Coca-Cola National Tournament is completed today http://www.soccerethiopia.net/football/39489	The country the products or the copy Tatnall today http://www.soccerethiopia.net/football/39489
twitter	3ኛው የኮካ ኮላ ሀገር አቀፍ የወጣቶች እግር ኳስ ውድድር ተጠናቀቀ http://www.ena.gov.et/index.php/sport/item/17297-3 …pic.twitter.com/HXaMDMYSGF	the 3rd Copa Coca-Cola national youths competition is ended http://www.ena.gov.et/index.php/sport/item/17297-3 …pic.twitter.com/HXaMDMYSGF	3rd Coca-Cola National Youth Football Competition ends http://www.ena.gov.et/index.php/sport/item/17297-3… pic.twitter.com/HXaMDMYSGF	3 young people in the cocoa or in the imperfect, and the http://www.ena.gov.et/index.php/sport/item/17297-3 ...pic.twitter.com/HXaMDMYSGF
twitter	የ2009 ኮፓኮካ ኮላ ሀገር አቀፍ ውድድር ተጀምሯል http://www.soccerethiopia.net/football/30092	The 2009 Copa Coca Cola competition has started http://www.soccerethiopia.net/football/30092	The 2009 KopaCoca Cola Nationwide Competition Launched: http://www.soccerethiopia.net/football/30092	The 2009 national Kopacka or to the people. http://www.soccerethiopia.net/football/30092
