Domain	Source Sentence	Reference Translation	Google Translate	Yandex Translate
news	በጂግጅጋ ከተማ ህዝባዊ ጉባኤ ዛሬ ይካሄዳል	The people’s symposium will be held in Jijiga city today.	A public meeting will be held in the city of Giggiga today	Today rejigged the public conference area
news	ስለፌዴራላዊ ሥርዓቱ ልዕልና!	For the sovereignty of federalism!	About the sovereignty of the federal system!	The Confederate system of Leela!
news	ህዝቡ “የሥልጣን ሊዝ አዋጅ” ሊያወጣ ነው! ሥልጣን በሊዝ ሊሆን ነው - እንደ መሬት	The people are going to make "Authority for rent" Authority is going to be for rent - just like for land!	The people are about to issue a &quot;power lease proclamation&quot;! Authority is about to be leased - like land	The “PS proclamation authority” of the young! PS it may be in authority - as in the
news	በሰማያዊ ፓርቲ ምልክት መወዳደር አለብኝ የሚለው ፓርቲ ከምርጫ ቦርድ ጋር ተወዛገበ	The party that uses the same banner as the Semayawi party is in conflict with the election board.	The party that I had to contest with the blue party logo was contested with the Electoral Board	The Heavenly Signs part I election to board " and " the Mudder that
news	የኦሮሞና የአማራ ሕዝቦችን ያገናኘው መድረክ ለምን አስፈለገ?	Why is a platform to congregate  the Oromo and Amhara people needed?	Why the Oromo and Amhara Peoples Forum?	The Oromo people by the Amhara agencies unwanted forum?
news	በኢትዮጵያ የመጀመሪያው የሰላም ሽልማት ለዶ/ር አቢይ አህመድ ተሰጠ	The first peace prize to be awarded to an Ethiopian has been awarded to Dr. Abiy Ahmed.	The first Peace Prize in Ethiopia was given to Dr. Abby Ahmed	The peace in the first do/given ten of Paris
news	የልማት ግቡ ያልደረሰባቸው የህብረተሰብ ክፍሎች	The parts of society where the development goal couldn't address.	Segments of society that have not reached its goal of development	The development units have been made to the tax
news	ለሰልፍ አደባባይ በወጡ ሰላማዊ ዜጎች ላይ የተፈጸመውን ጥቃት እናወግዛለን….ከፍተኛ ሴት አመራሮች	We condemn the violence against the peaceful protestors …..Higher women leadership.	We denounce the violence against civilians who went out to the streets ... Senior female leaders	The peaceful citizens in a public attack anagran it was fulfilled....The top women leadership
news	የኢትዮጵያ ዜና አገልግሎት (ኢዜአ) እንደገና ሊቋቋም ነው	The Ethiopian news broadcasting agency (ena) is to be re-established.	The Ethiopian News Service (EIA) is about to be reestablished	The news services (to) of lielam again
news	ማሸነፍም መሸነፍም እንደ አሜሪካ ምርጫ!	Win or lose like the American election!	Winning or winning is like the American election!	Machineries machineries selection to the United States!
news	ተቃዋሚ የፖለቲካ ፓርቲዎች በኢህአዴግ ዳግም ተሀድሶ ዙሪያ ምን አሉ?	What do opposition political parties have to say about the EPRDF reform?	What do opposition political parties have to say about the EPRDF reform?	The opposition political parties for what those in the world?
news	ለህዝቦች ደህንነትና ዘላቂ ሰላም መረጋገጥ የህግ የበላይነትን ማስከበር ይገባል— የወላይታ ዞን ምክር ቤት አባላት	To ensure sustainable peace and security of people, the rule of law should be enforced - members of the Wolaita Zone Council	The rule of law must ensure law and order for the welfare of the people - members of the Wolayita Zone Council	To ensure that peace and security of nations and the supremacy of the president in— council members of the wolayita zone
news	እግሪ ሃሪባ ከመቀለ ከተማ በቅርበት የምትገኝ የገጠር መንደር ናት። በ2003 ዓ.ም ይህችን መንደር በመቀሌ ከተማ አስተዳደር ስር መግባት አለባት የሚል ውሳኔ ተላለፈ። የመንደሯ ነዋሪዎች ተቃወሙ። ተቃውሞው ተካሮ በርካቶች ታሰሩ፣ መንደሯም 'አልባኒያ' የሚል ተቀጥላ አገኘች።	Egri hariba is a village located near mekelle. In 2003, it was decided that this village should be  run under the Mekelle city administration. The villagers protested against the decision made by the council.The protest was over and several were arrested, as a result the village got a byname of “Albaniya”.	Hagrid Harba is a rural village located near the town of Mekele. In 2003, it was decided that the village should be under Mekele city administration. The villagers protested. The protest was intensified and many were arrested, and her village was found to be &#39;Albania.&#39;	City are in the camera area at the itemtoedit is. In 2003.What this camera must be under the management of the village outside of the city in the decision tollerate. The team used. Arrested protest there Prices, money 'Albania' when she was in the " A " together.
news	የሕወሓት ማዕከላዊ ኮሚቴ ራሱን ያየበት መነጽር	The way the TPLF central committee saw itself.	The glasses of the Central Committee of the Confederate	Theweather himself in the Central Committee to achieve those goals
news	«በህገ ወጦች ስለታጠርን ፍትሐዊ የንግድ ውድድር ማካሄድ አልቻልንም»- የሳሪስ አካባቢ ነጋዴዎች	We are unable to conduct fair trade competition because we are bound by illegal merchants.	“We cannot conduct fair trade competition because we are bound by the law” - Saris area traders	"The prime minister said on his part Ethiopia is in the alarm business contatore"- says local merchant tools
news	ዳሰሳ ዓርብ ጠዋት ጥር 22 2007 ዓ.ም::	Dasesa Friday morning January 22, 2007:	Navigation Friday morning January 22, 2007	Friday morning January 22 the 2007 survey.What::
news	መንግሥት ከኢሠማ አመራሮች ጋር የሚነጋገርበት የውይይት መድረክ ሊዘጋጅ ነው	The government is about to set up a forum with the leaders of the ISEMA	The government is about to set up a dialogue forum with the leaders of the IS	Key to the presidency of the forum of litigation gamingharbor
news	ቱርክ ሶሪያ ላይ ጥቃት እንድትፈፅም ይኹንታዋን እንዳልሰጠች አሜሪካ ገለፀች	The United States has said that Turkey has not declared an attack on Syria.	The United States has said that Turkey has not surrendered it to Syria	Turkey attack Syria for the United States thongtapan andalites Anton glass
news	የሶማሊያ ሪፐብሊክ ፕሬዝዳንት መሐመድ አብዱላሂ አዲስ አበባ ገቡ	President of the Republic of Somalia Mohamed Abdullahi arrived in Addis Ababa	President of the Republic of Somalia Mohamed Abdullahi arrives in Addis Ababa	The Republic of the the president as he signed in Addis Ababa
news	የጀርመኗ መራሒተ መንግሥት አንገላ መርከል መንግሥት ለተቃዋሚዎችና ለሲቪክ ማኅበራት ሰፊ የፖለቲካ ዕድል እንዲሰጥ ጠየቁ	The German leader Angela Markel asked the government to give a broad opportunity for opposition parties and civil associations..	German opposition leader Angela Merkel demanded political victory for opposition and civil society	TheGerman meat and angle of the marker of the country with the tools to provide an opportunity for the broad political demands of
news	ኢትዮጵያ ግብፅና ሱዳን በዓባይ ጉዳይ ረቂቅ ፖለቲካዊ መግባባት ላይ ደረሱ	Ethiopia and Egypt have reached on a drafted political agreement concerning issues related with the Nile river.	Egypt, Sudan and Egypt reach an abstract political agreement on the Nile	Egypt Sudan Ethiopia on his part said the draft of the political can communicate it once they arrived
news	በኢትዮጵያ ፌዴራሊዝም ዙሪያ በሀረር የተካሄደ ውይይት መስከረም 22፣ 2009 ዓ/ም	A meeting on Ethiopian Federalism held at Harar on September 22, 2009 E.C.	HARGEISA - A Discussion on Ethiopian Federalism: September 22, 2009	Ethiopia Addis Ababa discussion around it there refederalisation of the September 22, 2009 in/what
news	አመራሩ ለውጡን በመከተል የህዝቡን ጥያቄዎች ለመመለስ ራሱን ሊያዘጋጅ ይገባል- የአርባምንጭ ሰራተኞች	Workers from Arbaminch suggested that the government should follow the changes and get prepared to answer questions from the people.	The leadership must prepare itself to respond to the people’s questions by following the change - Fortune employees	The change project will support people to follow himself in the litigation understand that to return to questions - staff farther
news	የፀረ ሙስና ትግሉ ማነቃቂያ የ25 በመቶ ሽልማት	25% award on awakening of fight against corruption	25 percent reward for anti-corruption struggle	Some political parties are not at the 25 percent of the mangaka
news	በጠቅላይ ሚኒስትር ኃይለ ማርያም የሚመራ ልዑክ በሳዑዲ ዓረቢያ የሥራ ጉብኝት አደረገ	A team led by Prime Minister Hailemariam had a work related visit in Saudi Arabia.	A delegation led by Prime Minister Hailemariam held a working visit to Saudi Arabia	The Prime Minister guided Mary through the power of the work he did for the interview link
news	የጌዴኦና ምዕራብ ጉጂ ዞን አጎራባች ወረዳ ነዋሪዎች የሰላም ጉባኤ አካሄዱ	People living in Gedeo and neighboring districts of Western Goji held a meeting about peace.	Residents of Gedeo and West Goji Zone held a peace conference	Western geo guy peace conference agrees the residents of the community.
news	ሞጋች ቀጥታ የውይይት መድረክ እሁድ ህዳር 04 2009 ዓ.ም::	The live debate stage Mogach will be held on November 03, 2009 E.C.	Mogat Live Chat	The moment on Sunday 04 November 2009 in discussion forum.What::
news	የጠቅላይ ሚኒስትሩ የጋናና ጊኒ ቆይታ ሲዳሰስ	Covering the prime minister's stay at Ghana and Guinea	Prime Minister&#39;s visit to Ghana and Guinea	Ghana Guinea to the season of the Supreme
news	በፍትሕ ሥርዓቱ ውስጥ ያሉ ትንንሽ አምባገነኖች ሕዝቡን ወደ መጨረሻው የአመፅ አማራጭ እየገፉት መሆኑ ተገለጸ	It was reported that the low level dictators situated within the justice system, are encouraging the people towards their last option of revolting.	Tiny dictatorships are pushing the people to the last violent alternative	In the system, such as during his people a daily reminder that I end and it's a small option that the eight foot ተገለጸ
news	መንግስት የአልጀርስ ስምምነትን ከመተግበሩ በፊት ህዝቡን ያወያይ- መኢአድ	The government should hold a meeting with the people before implementing the Algiers agreement - AEUP	The government discusses the people before implementing the Algiers Agreement: AIM	The government is alert the people Center for Area Agreement - lead
news	ኢትዮጵያዊው ተመራማሪ ዶ/ር መለሰ ተመስገን አህጉራዊ ሽልማት ተቀበሉ	Ethiopian researcher Dr. Melese Temesgen has received continental award.	Ethiopian researcher Dr. Meles Zenawi received the continental award	Temerarios on icon/ten Alegre received the award to those at regional economic
news	የቱርክ ትምህርት ቤቶች ለጀርመን ባለሀብቶች በሽያጭ እንደተላለፉ መሥራቾቹ አስታወቁ ለቱርክ መንግሥት እንደሚተላለፉ መንግሥት አስታውቆ ነበር	Though the Turkey Government has announced that the schools in the country will be given to the government, the owners have announced that the schools have been sold to German investors	Turkey announced on Tuesday that the Turkish schools would be sold to German investors.	Vasari's first local investment houses for sale ballots of the German intel Education disclosed the nature of the kingdom of flowers was anisometropia assistance
news	የአንድ ታላቅ ሰው ታሪክ	The story of someone great	The story of a great man	The greatest man of history
news	የአዲስ አበባ ቄራዎች ድርጅት ለዘመን መለወጫ በዓል በቂ ዝግጅት ማድረጉን ገለፀ	Addis Ababa Abattoirs Enterprise have announced their full preparation for the upcoming holiday.	The Addis Ababa Chamber of Commerce announced that it has made sufficient preparations for the New Year&#39;s celebration	Addis Ababa abbatoirs ገለፀ enough that the head of the event
news	ባለፉት 6 ወራት ከወጪ ንግድ 1 ነጥብ 37 ቢሊየን ዶላር ተገኝቷል	In the past 6 month 1.37 Billion USD  profit was made from export business	In the last 6 months, $ 1.37 billion has been earned from export trade	Over the past 37 6 months USD 1 million costs in business activity.
news	10ኛው የአሜሪካ - አፍሪካ ቢዝነስ መድረክ ከሰኞ ጀምሮ በአዲስ አበባ ይካሄዳል	The 10th America - Africa trade conference will be held in Addis Ababa starting from Monday.	The 10th American - Africa Business Forum will be held in Addis on Monday	10 U.S. - Africa Business Forum in Addis Ababa Monday through the country.
news	ልማት ባንክ በማምረቻ ዘርፍ ለሚሰማሩ ባለሀብቶች 70 ቢሊዮን ብር ብድር አዘጋጀ	Lemat Bank has allocated 70 Billion birr loan for investors working on production area	Development Bank has issued 70 billion birr loan to investors engaged in manufacturing sector	The bank loan of which 70 ballots in the summers he prepared a lunisolar
news	የጎዴ ከተማ ነዋሪዎች የመሰረተ ልማት ጥያቄዎቻቸው እንዲፈቱላቸው ጠየቁ	Residents in Gode shared their complaint about the infrastructure in the area	The people of Goode City asked for their infrastructure requests to be resolved	The residents of the city of God demands, the candidature of the questions
news	የሥራ ዕድል ባለማግኘታቸው ቅሬታ እንደፈጠረባቸው በደቡብ ወሎ ዞን በማህበር የተደራጁ ወጣቶች ገለጹ	The youth in South Wolo have shared their complaint about the lack of job opportunity	The youth organized by the union in South Wollo Zone have complained of lack of employment opportunities	Independentei opportunity for the complaint to lateral in the best interests for the youth in Addis Ababa yesterday
news	ድርጅቱ የገነባው የሩዝ ማቀነባበሪያ ፋብሪካ አገሪቱ ከግብርና ወደ ኢንዱስትሪ ለምታደርገው ሽግግር ሁነኛ ማሳያ ነው	The rice processing factory built by the organization proves to play a key role in the country's transition from Agriculture to Industrial way of production.	The rice processing plant the company built is a prime example of the country&#39;s transition from agriculture to industry.	The generation of rice in the country and to the agriculture industry magnetola very lumnaderm view of the transfer of
news	ነባር የማኑፋክቸሪንግ መሬት ጥያቄዎች በተናጠል እንዲስተናገዱ ተወሰነ	It was decided that the existing manufacturing land claims would be handled separately	It was decided that the existing manufacturing land claims would be handled separately	In Ethiopia, existing in a particular listener questions corporately and individually
news	የደረጃ ምልክት የማይጠቀሙ ውሃ አምራቾች ላይ ህጋዊ እርምጃ ይወሰዳል- የንግድ ሚኒስቴር	Legal action will be taken against water producers that do not use the standard mark - Ministry of Commerce	Legal action will be taken against water producers who do not use the standard mark - the Ministry of Commerce	Sign of the imaginary countries in Africa for legal action as it - business affairs
news	በኦሮሚያ ክልል ሰሜን ሽዋ ዞን የቡና ልማት በእጥፍ ለማስፋፋት እየተሰራ ነው	North Shoa Zone of Oromia State is working to double its coffee development	The North Shoa Zone of Oromia is working to double its coffee development	From the capital of the North region will be active in the development, he said
news	በቆላማ አካባቢ ከደጋው በሶስት እጥፍ የሚበልጥ የስንዴ ምርት እንደሚገኝ በሰርቶ ማሳያ ተረጋገጠ	It was confirmed by demonstration that in the lowland area, three times as much wheat would be harvested compared to the highlands	It was confirmed by demonstration that in the lowland area, three times as much wheat would be found in the highlands	Three times it come from local production in the region, for he is of the view that the
news	በከተሞች የህብረተሰቡ ተጠቃሚነትን ለማረጋገጥ በትኩረት እንደሚሰራ ተገለጸ	It is announced that work will be done to ensure the benefit of the community in the cities	He said he would work hard to ensure the benefit of the community in the cities	It is in the works to ensure that the focus is on The ተገለጸ
news	ንብ ኢንተርናሽናል ባንክ ባለ 37 ፎቅ የዋና መስሪያ ቤት ህንጻ በአዲስ አበባ ሊያስገነባ ነው	Nib International Bank is about to build a 37-story headquarters building in Addis Ababa	NB International Bank is about to build a 37-story headquarters building in Addis Ababa	37 the main floor of the International Bank, Ethiopia-Addis Ababa can be viewed in a building of assignable
news	በአገር ውስጥ ሠርቶ የመለወጥ ተምሳሌቱ ባለራዕይ ወጣት	A visionary young man with a vision of work and change locally	A visionary young man with a vision of working locally	In the region, change in the young tomato revelation
news	የኢትዮጵያ ገቢዎችና ጉምሩክ ባለስልጣን በሩብ ዓመቱ ከ36 ነጥብ 9 ቢሊየን ብር መሰብሰቡን ገለፀ	The Ethiopian Revenue and Customs Authority said it collected 36.9 billion birr in the quarter	The Ethiopian Revenue and Customs Authority said it collected 36.9 billion birr in the quarter	The Ethiopian Revenue Customs Authority 36 point quarter of the year Meselson 9 million ገለፀ
news	ለመሪዎችና ለዝነኞች ጌጣጌጦች በመስራት የተሳካላቸውአባትና ልጅ	successful father and son working jewelry for leaders and celebrities	A successful father and son working for ornaments and celebrities	Gotsagalatino to the leaders of theresonant generates
news	ዘመናዊና ቀልጣፋ የግብር አሰባሰብ ስርዓት መዘርጋት ለመንግስት በጀት ውጤታማነት ቁልፍ ጉዳይ ነው -የቋሚ...	Establishing a modern and efficient tax collection system is key to the success of the government budget ...	Establishing a modern and efficient tax collection system is key to the success of the government budget ...	Modern tax collection system and they are the key of productivity in Ethiopia and the government-he added...
news	ፍትሃዊነትና እኩል ተጠቃሚነት	Justice and Equity	Equity and equal opportunity	Forthwith as equal
news	የመቀሌ ከተማ አስተዳደር መሬት ወስደው ባላለሙ ባለሀብቶች ላይ እርምጃ ሊወስድ ነው	Mekelle city administration is about to take action against investors who have not started work after taking land	Mekelle city administration is about to take action against investors who have not taken land	The city of Temecula Palm of ballots, it may take measures it ወስደህ
news	የኢትዮጵያ ንግድ ባንክ ጠቅላላ ሀብቱ 242 ቢሊዮን መድረሱን አስታወቀ	Commercial Bank of Ethiopia announced that its total assets have reached 242 billion	Commercial Bank of Ethiopia announced that its total assets have reached 242 billion	242 the business of the said Bank in the total
news	አዳማና የኢንቨስትመንት ብሩህ ተስፋዋ	Adama and her investment prospects	Adam and her investment prospects	And in the bright testdata Astana
news	በጎባ በጥቃቅንና አነስተኛ ዘርፍ የተሰማሩ ወጣቶች ውጤታማ ሲሆኑ ጋሰራዎቹ ሁኔታዎች አልተመቻቸልንም አሉ	In Goba, the youth in the small-scale sector were successful and the galleries were unsuccessful	He said that in Gaba, the youth in the small-scale sector were successful and the galleries were unsuccessful	Productivity for micro and small we the the conditions Young said that measures acetaminophen
news	ኢንቨስተሮች አዲሱን የልማት ባንክ የብድር መመርያ ተቃወሙ	Investors opposed the new development bank loan guidance	Investors opposed the new Development Bank&#39;s credit guidance	The new business companies bank on the memory of the team
news	«የቅባትና የጥራጥሬ ምርቶች በአቅርቦትና በዓለም ገበያ ይፈተናሉ»- አቶ ሙሉጌታ መሐመድ የቅባት እህሎችና የጥራጥሬ ምርቶች ግብይት ዳይሬክተር	"Oil and Beverage Products Tested in Supply and World Market" - Mulugeta Mohammed	&quot;Oil &amp; Beverage Products Tested in Supply and World Market&quot; - Mulugeta Mohammed	"It supplies products, oil seeds generate in Ital in the world"- the president of the marketing products generate the castor beans
news	የግብዓት ጥራት ችግር- የጨርቃ ጨርቅ ዘርፍ ተግዳሮት	Input quality problem: The challenge of the textile sector	Input quality problem: The challenge of the textile sector	The quality of the input - we will continue the work in the
news	ኢትዮጵያ የኢ-ቪዛ አገልግሎት ጀመረች	Ethiopia launches e-Visa service	Ethiopia launches e-Visa service	And in-service started and the visa
news	ጣሊያናዊውን ወጣት በመግደል የተጠረጠረው ግለሰብ በቁጥጥር ሥር ዋለ	A man suspected of killing an Italian youth has been arrested.	A man suspected of killing an Italian teenager has been arrested	Ballanation', the young person used in the temperature of the root
news	የሒልተን ሆቴል አስተዳደርና የሠራተኛ ማኅበር እየተወዛገቡ ነው	The management and work union of Hilton hotel are in dispute.	The management of the Hilton Hotel and the Labor Union are in contention	The staff of hotel Helena is either the
news	ታዳጊዋን በስለት ወግቶ ገድሏል የተባለው ወጣት ተከሰሰ	A young man who stabbed a teenage girl to death has been accused.	The young man who allegedly stabbed and killed her teenager has been charged	Young teen Modell that besplatnu get his titles
news	አገልግሎቱን ያዘመነው ዓይደር ሆስፒታል	Eider hospital, keeping its service up-to-date	Elder Hospital, which updated the service	Easements for the service user to a hospital
news	ዶክተር ደሳለኝ - ሥራን ከሕይወታቸው ያቆራኙ ሁለገብ ምሑር	Dr Desalegne , an all-round scholar whose life is deeply engaged with work.	Dr. Dessale - a versatile scholar who has put work away from their lives	The construction of The - an elite actors in their comprehensive work
news	ስኳር ኮርፖሬሽን በአገሪቱ የስኳር እጥረት የለም አለ	Sugar corporation says there is no shortage of sugar in the country.	Sugar Corporation says there is no shortage of sugar in the country	The corporation the corporation the corporation the country, said the there is no
news	ከ800 ሺሕ በላይ ሰዎች ለመተንፈሻ አካል በሽታ ተጋልጠዋል ተባለ	More than 800 thousand people are said to have been exposed to respiratory disease.	More than 800,000 people are said to have been exposed to respiratory disease	More than 800 cemeteries in the thousands tagliatelle body disease
news	አምባሳደር እንዲሆኑ የሚጠበቁት ሆቴሎች	Hotels that are expected to be ambassadors	Hotels expected to be ambassadors	Hotels that expected to be the
news	የባሕር ዳር ወወክማ በ49 ሚሊዮን ብር አዲስ ማዕከል ሊያስገነባ ነው	Bahirdar’s YMCA to build new center with 49 million birr.	The Coast Guard is about to build a new center at 49 million birr	The end-to-end 49 can be touchy in the center of new assignable
news	በትምህርት ጥራትና ሥነ ምግባር ዙሪያ የአዲስ አበባ 35 ሺሕ መምህራን ሥልጠና ላይ ናቸው	Around 35 thousand teachers in Addis Ababa are participating in a training program focusing on education quality and ethics.	Addis Ababa&#39;s 35,000 teachers are in training on quality and ethics	The quality of education for the training 35 teachers in Addis Ababa, thousands are
news	“ለምን ምሳ አብረን አንበላም…”	Why don’t we have lunch together?	&quot;Why don&#39;t we eat lunch together ...&quot;	“Together, e.g., by the Bentley...”
news	በ2010 በጀት ዓመት ከውጭ አገር ጎብኚዎች 3 ነጥብ 5 ቢሊዮን ዶላር ገቢ ተገኝቷል	3.5 billion dollars have been earned from foreign tourists throughout the 2010 fiscal year.	In 2010, $ 3.5 billion was earned from foreign tourists	In the 2010 budget year visitors revenue USD 3 billion in 5 point
