Domain	Source Sentence	Reference Translation	Google Translate	Yandex Translate
wiki	ይህ ምናልባት የዛሬው ሶማሊላንድ ዙሪያ ይሆናል።	This maybe the surrounding of the now called Somalilands	This may be around today&#39;s Somaliland.	This may be in today's Somaliland.
wiki	(ይህ ፖለቲካ ነክ ጽሑፍ መሠረት ወይም መዋቅር ነው።	This is the basis or structure of a political essay.	(This is the basis or structure of a political essay.	(This politics-related structures or in the text.
wiki	፲፱፻፸፱ ዓ/ም - በአምሣዎቹና ስድሳዎቹ አሥርተ ዓመታት ‘ቦናንዛ’ በተባለው የትይዕንተ መስኮት (ቴሌቪዥን) ትርዒት ‘ቤን ካርትራይት’ የነበረው ካናዳዊው ተዋናይ፣ ሎርን ግሪን በተወለደ በ፸፪ ዓመቱ አረፈ።	1979 A.D - In the fifties and sixties, the Canadian actor who starred in 'Bonanza' television show 'Ben Cartwright'. Loren Green died at the age of 72.	- ም - ም - - - - - - - - - - - - - - - - - - - - - - - - - - - - - - - - - - - - - - - - - - - - - - - - - - - - - - በአ በአ በአ በአ በአ በአ በአ በአ በአ በአ በአ በአ በአ በአ በአ በአ በአ በአ በአ በአ በአ በአ በአ በአ በአ በአ በአ በአ በአ በአ በአ በአ በአ በአ በአ በአ በአረፈረፈ አ ካ አ አ አ አ አ አ አ አረፈ አ አረፈረፈ አ አረፈረፈረፈ አ አ አ አ አ አረፈ አረፈረፈረፈረፈረፈረፈረፈ አረፈ	The ፲9፻፸9/what - are soon betametasona years ‘Sonata’ in the window tint (TV) trying ‘my heart Carteret’ way of Canadair, the relationship with Eritrea porn was born to the Greek.
wiki	ሆኖም ከደቡብ ጋር የነበረው ችግር አልቀረም ነበር።	But the problem with the south remained.	But the problem with the South remained.	The problem however was to the south of the.
wiki	ሴት ለቤት ወፍጮ ለዱቄት	Female for a home, mill for a flour .	Female for homemade flour	Owner education of women
wiki	የጎልማሳነት ጊዜያቸውን በአባታቸውን እርሻ ላይ በመርዳት እንዳሳለፉም ይነገራል።	It is said that they have spent most of their adulthood in their fathers farmland.	Reportedly, they spent their adult life helping their father on the farm.	It doesn't help and the US andalso reglement Babatunde ocean life.
wiki	ፓፓ ዮዓነስ ፓውሉስ (ዮሐንስ ጳውሎስ) 1ኛ፣ ልደት ስም አልቢኖ ሉቻኒ (1905 ዓም ጣልያን ተወለዱ) ለ33 ቀን በ1970 - 1971 ዓም ላይ የሮሜ ፓፓ ወይም የሮማን ካቶሊክ መሪ ነበሩ።	Pope ioannes Paulus (John Paulo) 1st :- Birth name Albino Luciani(born 1905 in Italy) was a Roman catholic leader from 1970-1971 for 33 days.	Papa Joanus Paulus (John Paul) 1st, Birthdate Albino Luchini (born 1905, Italy) was a Roman Catholic or Roman Catholic leader for 33 days in 1970-2001.	Japanese Papa Paulus (Paul John) 1, birth name albino Lucani (Italian born in 1905 ዓም) day 33 1970 - 1971 ዓም or Napa for the Roman leaders were Roman Catholic.
wiki	የዚህም ፍራሽ እስከ ዛሬ በቴቤስ ይታያል።	The ruin is still visible in Thebes.	The mattress is still visible in Thebes to this day.	As of today, why to the tubes.
wiki	ሬማ ደሴት በደቡባዊ ምስራቅ ጣና ሐይቅ የምትገኝ ደሴት ናት።	Rema is an island located south east from lake Tana.	Rima Island is an island in the southeast of Lake Tana.	Ram Island island in the East China itemtoedit can isobutane is.
wiki	ፐንጃብ በስሜን የምትገኝ የሕንድ ክፍላገር ናት።	Punjab is a regional state of India located in the north.	Punjab is an Indian suburb of India.	Itemtoedit of the Punjab and North India, and Kepler.
wiki	ቀድሞ የሸተውን ወፍ ይበላዋል ቀድሞ የተናገረውን ሰው ይጠላዋል	the first to sell will be eaten by the bird, the first person to speak will be hated by other	He eats the fowl already, and hates the person who has already said it	If the man speaks of the Eastern liberal that hates what you're doing
wiki	ለዳርቻው ሲሳሱ መካከሉን ተነሱ	They lost the center for the shore.	As they kissed the shore, they stood up in the middle	Learned arise between season
wiki	ከዚህም ጭፍጨፋ በተአምር አምልጦ ወደ ሱዳን ይሰደዳል፡፡	He miraculously escaped the genocide to sudan.	After this, the Holocaust has miraculously escaped to Sudan.	He added it to the total, and also Isdell
wiki	ከነዚህም ዋነኛው የኦጋዴን ጦርነት ነው።	From among this , the Ogaden war was the main.	One of these is the Ogaden war.	It was a major war of these.
wiki	በአካድ ውስጥ የክፍላገሩ ዋና ከተማ ሆኖ ቀረ።	In accad It remained the capital city of the regional state.	In Acad he remained the capital of the province.	It peaked in the city of the icefloe.
wiki	አንድ ግለሰብ ዕዳ ውስጥ እየገባ መሆኑን መረዳት ሲጀመር መጀመሪያውኑ የዕዳውን አይነት መለየት አስፈላጊ ነው።	when a person realizes that he is dwelling in a debt , it is better to understand the type of the debt first.	It is important to first identify the type of debt you have when you understand that an individual is in debt.	Light industrial city project and the company understand that the person in the first sort type important segment of the season.
wiki	ፊደሉን ፡ የፈጠረው ፡ ከማየ አይኅ ፡ አስቀድሞ ፡ የሴት ፡ ልጅ ፡ ሄኖስ ፡ ነበረ።	The one who created the word before was a children of a woman, Henos.	He was the eldest daughter of Enos before the eye of the eye.	Finding   created   with it   the   women   of   Lens   was.
wiki	15፤በጌታ፡ፊት፡ታላቅ፡ይኾናልና፥የወይን፡ጠጅና፡የሚያሰክር፡መጠጥ፡አይጠጣም፤ ገናም፡በእናቱ፡ማሕፀን፡ ሳለ፡መንፈስ፡ቅዱስ፡ይሞላበታል፤ 16፤ከእስራኤልም፡ልጆች፡ብዙዎችን፡ወደ፡ጌታ፡ወደ፡አምላካቸው፡ይመልሳል።	15 For he shall be great in the face of the Lord, he shall drink neither wine nor any intoxicant; he shall be filled with the holy ghost even from his mother’s womb 16:- and from the children of Israel he shall turn many to the Lord.	15 For he shall be great in the sight of the Lord, and shall drink neither wine nor strong drink; and he shall be filled with the Holy Ghost, even from his mother&#39;s womb. Returns.	15:the Lord before great Yehonatan, and wine wine and gambling, and drink item: team Mother of season  while Spirit the important: 16:Israel Children They to the Lord to their God Intelsat.
wiki	ድግርና ገባር ሲተካከል ያምር	pretty Cool when it's easy and smooth	Beautiful when straddling the bottom	Product data setaccel bar
wiki	የጳውሎስ መልዕክት ወደ ሮማውያን ምዕራፍ ፲ 1፤ወንድሞች፡ሆይ፥የልቤ፡በጎ፡ፈቃድና፡ስለ፡እስራኤል፡ወደ፡እግዚአብሔር፡ልመናዬ፡እንዲድኑ፡ነው።	The message of Paul to the Romans chapter 1, Dear brothers, it is my hearts good will that god may save Israel.	Paul&#39;s Letter to Romans Chapter 1: Brethren, my heart&#39;s desire and prayer to God for Israel is, that they might be saved.	Paul's message to the Roman ፲ Chapter 1:Brothers The Lord, and my flesh and my heart the the About Israel to God elimination to be saved of.
wiki	ለምሳሌ ግቤቱ እውነት (1) ከሆነ፣ በአፍራሽ አምክንዮ ውጤቱ ውሸት (1) ይሆናል ማለት ነው።	For example if the parameter is true (1), Because of false (1) reasoning the result will be false.	For example, if the parameter is true (1), the negative result will be false (1).	For example, get true (1) if, Amigo is that the false result of (1) means will be.
wiki	አገሩ እስከ 1517 ዓም ድረስ ቴውቶኒክ ግዛት ተባለ።	Until 1517, the country was named as Tewtonic regime.	It was called the Teutonic State until 1517 AD.	The state of the country in 1517, the Teutonic ዓም.
wiki	የጉታውያን ንጉሥ ኤሪዱፒዚር እራሱን እንደ አካድ ነገስታት በማምሰል፣ ማዕረጉ 'የጉቲ ንጉሥና የ4 ሩቦች ንጉሥ' ተባለ።	The Gutanian's king Eridupizir considered himself superior and named his throne as "Guti's king and king of 1/4th".	Emperor Purduezer of Gutti, by pretending to be the Akkad kings, was entitled &#39;King of Gutti and king of four quarters&#39;.	They aresuper flotation Nagasaki as the king of Summer himself, meet 'Nina got 4 tubes of' the.
wiki	የዱሮ ዘፈኖችን አዲስ ሕይወት በመስጠት ዘፍኛለሁ፡፡	I have sang by giving life to the old songs.	I sang old songs and given new life.	Songs like new life for software
wiki	በእስር ቤት ውስጥ ሁሉም ነበር የሚያውቀኝ፡፡	Everyone in prison knew me.	Everyone in the prison knew me.	Was all be in prison for thematics
wiki	ሆድ ለተተባሰው ማጭድ አታውሰው	Don't lend a knife for the one who is sad.	Do not remember the stomach for the swollen glands	D. letters home Atasu
wiki	በአሁኑ ጊዜም ከንጉሠ ነገሥቱ አናት ላይ የተሸለተውን ሹሩባ ፀጉር ጨምሮ ሌሎች ቅርሶች በእንግሊዝ አገር የተለያዩ የሥነ-ቅርስ መዘክሮች ውስጥ ተቀምጠው ይገኛሉ።	Even now, the braid shaved from the king and other historical items are found  in different museums of England.	Currently, other artifacts, including the ruffled hair of the emperor, are preserved in various museums in England.	Now the tessellation of the Kings ጊዜም confused Curran Antiques in the country including various other hair-markers are available in heritage as he.
wiki	የሽሮ ድንፋታ እንጀራው እስኪመጣ ነው	Shiro's confidence is until the injera comes.	The syrup is until the bread comes	Enter of defeat, but wait until there
wiki	በከተማይቱ መሃል ዕምብርት የሚገኙት ወሎ ባህል አምባ እና ምን ትዋብ አዳራሾች ለከተማዋ የኪነ ጥበብ እድገት ከፍተኛውን ድርሻ ይወስዳሉ።	Wolo Bahil Amba and Mintewab halls, situated in the center of the city, take the major role of the growth of  the city's art.	In the center of the city, the Wollo Cultural Hall and its beautiful halls play a major part in the city&#39;s artistic development.	The city, and in the best interests of the members and address member of culture that they also take such high growth of the China wisdom of the government.
wiki	የወደፊቱ ዳግማዊ እያሱ ወደ ስልጣን በወጣበት ጊዜ ገና ህጻን ስለነበር እናቱ እቴጌ ምንትዋብ የልጁ እንደራሴ ሆና ተሾመች።	When the future Eyasu II held the throne, he was a kid. Thus, his mother Empress Mentewab was appointed as his assistant.	His mother, Empress Mentewab, was appointed as the daughter of my son when he was still in power.	For young eyes to the future of the authority in the previous year had a child she was the child's mother was Thomas Anders this scenario cannot area.
wiki	የኢትዮጵያ ካርታ 1787	1787, Ethiopian map	Map of Ethiopia 1787	1787 the card
wiki	ሮበርት ሑክ (ከ18 ጁላይ 1635 እስከ 3 ማርች 1703 እ.ኤ.አ. የኖረ) እንግሊዛዊ ተመራማሪ ነበር።	Robert Hook (July 18, 1635 - March 3, 1703)  was a british scientist.	Robert Hook (who lived from 18 July 1635 to 3 March 1703) was an English researcher.	Huge Robert (18 July 1635 3 March 1703 and to.The.The. Who live up to) temperation was Angelica.
wiki	በኋላ ግን የሃሞን ልጅ ዲዮኒስዮስ ከኒሳ ተመልሶ ካሜሴኑስን አሸነፈው።	Hamon's son Diyonisyos Kenisa returned back and won over Kamesenus.	Later, Dionysus, son of Hamon, returns from Nassau and defeats Carmenus.	Back to Nissan after the son of Dionysius than the Cameleon, but to increase climate resilience.
wiki	ትንሽ እንደቆዩ እንደገና ያምራቸውና ቀስ ብለው ምንም ሳያሰሙ እራቁታቸውን ሊሄዱ ሲነሱ ወ /ሮ ማዘንጊያ ነቄ አሉና «አንቱ ወዴት ኖት በዚህ በጭለማ» ብለው ወይዘሮ ማዘንጊያ ሲጠይቋቸው።	Just after they stay a while, they wanted to do it again and got to start walking naked, Ms. Mazengia figured it out and asked "Hey you, where are you going this late?"	Again, a little later, when they got up to go naked without saying anything, Mrs. Mina nodded and asked, &quot;Where are you in this dark?&quot;	A little Google but cannot establish legal presence again to the Arrow season Ameratunga lines of what sins Brockton /the new material alone in the "not in Berkeley, not in that" who did not believe much of the material.
wiki	ሰኔ 11 ቀን - ግብጽ ሬፑብሊክ ሆነ።	On June 8, Egypt became a republic.	June 11 - Egypt becomes a republic.	Day June 11 - Republic of Egypt.
wiki	ቆዳ ማንጓጓቱን ስሱ መጓጓቱን	Making sounds with skin, the smooth is eager.	The skin is sensitive to the sensation	Maninarakorn generation having very sensitive skin
wiki	ኅዳር 19 ቀን፦ አልባኒያ ነጻነቱን ከኦቶማን መንግሥት አወጀ።	On November 29, Albania announced its freedom from Automan's government.	November 19: Albania declares independence from the Ottoman government.	Heart Day 19: least caution area of the kingdom of Albania.
wiki	እዝራ ፓውንድ የአሜሪካ ጸሐፊ ነበር።	Ezra Pound was  an american writer.	Ezra Pound was an American writer.	The United States and was the author of the button.
wiki	ማሊ በ1880 እ.ኤ.አ. በፈረንሣይ ቅኝ ተገዝታ «ፈረንሳያዊ ሱዳን» ወይም «የሱዳን ሪፐብሊክ» ትባል ነበር።	In 1880, Mali was colonized by France and was named as "French Sudan" or "Susan's Republic".	Mali in 1880; It was purchased by the French colony and was called &quot;French Sudan&quot; or the &quot;Republic of Sudan&quot;.	Mali and 1880.The.The. Review test frontin "with perennial" or "the Republic of Sudan" was the.
wiki	ለምሳሌ በሽፍትነት የሚያገኘውን ገንዘብ ለገበሬወች እያከፋፈለ ሞፈርና ቀንበር እንዲገዙ ይረዳ ነበር።	For example, he gave the money he got as a bandit to farmers so they can buy morph and yoke.	For example, it helped farmers buy morphine and yoke by distributing income to farmers.	For example, the respite money Asiatravel has been understood in several legatees opera Angel was a burden.
wiki	» ሲሉ አንድ ያለቃን ስራ ያየ ካህን «አለቃ ከልክለው ነው ሴቶች እንዳይገቡ» ብሎ ያስረዳል።	...a priest that saw a deed of one head will explain saying,"the boss has forbidden females to enter."	&quot;A priest who has seen an unprofessional man explains,&quot; He forbade a chief to prevent women from entering. &quot;	"He said that this work is in the "calcru to women in that he" demonstrates that.
wiki	ማር ይፈሳል ጠጅ በእመቤቴ ደጅ ።	Tej is made from honey and flows on my mother's land.	Honey flowed through the door of my mistress.	Apesar gate mark Bamber wine .
wiki	» 1724 ዓክልበ. - አሹር-ኒሹ - «ሻምሺ-አዳድ <...> ።	1734 AKLB.- Ashur Nishu- 《Shamshi-Adade <...>.	»1724 BC. - Ashur-Nush - &quot;Shamshi-Ada &lt;...&gt;.	"Also 1724. - Assure-Nico - "same-add <...> .
wiki	ባገኘው ህይወት ነው ብዬ ወደሚያላምጡት ሰዎች ሔድሁ፡፡	Assuming its life if I get it, I went to the bad people.	I went to people who thought it was the life I found.	I of the baroque Edu toimii life
wiki	ሥራዋ በኗሪ አገሯ በሰፊ ባይታወቅም ኖሮ በአውሮጳና በደቡብ አሜሪካ በተለይ ትወደዳለች።	Although her works are not well known in her country, she is adored in Europe and South America.	If her work is not widely known in her home country, she will be especially loved in Europe and South America.	Auto batteries are the berry they would benefit Tweedle especially in South America.
wiki	አርሰር ኮነን ዶይል	Arser Conan Doyle	Arson Connor Doyle	Are doing one
wiki	ፖርማ የእግር ኳስ ክለብ	Parma soccer team	Parma Football Club	The porno in the club
wiki	ለቡናሽ ቁርስ የለሽ ለነገርሽ ለዛ የለሽ	As u have no breakfast with your coffee, you have no charisma for your things	For those of you who don&#39;t have breakfast for breakfast, why not	Breakfast service lunch service rangers for that
wiki	በፓውሳኒዩስ ጽሑፍ ግን ከኦርጦፖሊስ ቀጥሎ ያለው ቅድም-ተከተል ከሌሎች ምንጮች ይለያያል፤ ማራጦስም በዚያ አይጠቀሰም።	However, on the writing of Pawsaniyos, the sequence following Orthopolice is different from other sources. Maratos is also not mentioned.	In the Pausanius text, however, the sequence that follows the Orthodoxus differs from other sources, and Maratus is not mentioned there.	Spousals corellis text next to it, but the pre-order of the other varies sources: Marathon on that item.
wiki	የማያልፍ ነገር የለም ምሽትም በማለዳ ይተካል	As nights are replaced by days, everything will pass too.	There is nothing that will not pass away, and will be replaced in the morning	There is no evening things up uniap ይተካል
wiki	ፊሊፕ ጆንሰን በሃርቫርድ የዲዛይን ትምህርት ቤት ነበር የተማረው።	Philip Johnson learned at Harvard designing school	Philip Johnson was educated at Harvard School of Design.	Alan Johnson's commentary on Philippians was by the Harvard School itemmargin.
wiki	አብዛኛውን ጊዜ ሰዎች በእያንዳንዱ እጆቻቸው ላይ አምስት ጣቶች አላቸው።	Most of the time, people possess 5 fingers on each hand.	People usually have five fingers on each of their hands.	It is often those young people each have five.
wiki	ናዚ ጀርመን በጀርመን ታሪክ አዶልፍ ሂትለር በናዚ ፓርቲ ጀርመን የመራበት ዘመን ወይም 1925-1937 ዓም. ነው።	Nazi Germany, in the history of Germany, was a period when Adolf Hitler led thr country with Nazi's Party or a time between 1925-1937.	Nazi Germany in German History Adolf Hitler During the Nazi Party Germany, or 1925-1937. it is.	Beach German German Germany history Adolf Hitler or the fertility of the Senate ዓም 1925-1937. Of.
wiki	የፊውዳሊዝም ሥር ዓት እንዲሁ በፈረንሳይ በሕግ ታግዷል።	Feudalism is also banned in France.	The roots of feudalism were also banned in France.	So are therewelcome Tamil root severance by law.
wiki	አምባው በእስልምና ግዛት በ8ኛው ክፍለ ዘመን ዓ.ም. ተሠራ።	The building was built on 8th century, during the Islamic regime.	The empire dates back to the eighth century AD It was made.	For more Islamic State began in the first century.What. Practices.
wiki	ወደ፡ቤትም፡በገባ፡ጊዜ፡ኢየሱስ፡አስቀድሞ፦ስምዖን፡ሆይ፥ምን፡ ይመስልኻል፧የምድር፡ነገሥታት፡ቀረጥና፡ግብር፡ከማን፡ይቀበላሉ፧ከልጆቻቸውን፡ወይስ፡ ከእንግዳዎች፧አለው።	When Jesus entered the room, he first asked, "Simon, from who do governments of the world take taxes from? Their children or their guests? What do you think?	And when he was come into the house, Jesus prevented him, saying, What thinkest thou, Simon?	To the We have made the Jesus previous:Simon The Lord, and what  tensile?The Earth Kings tax withholding tax with Isabella?Their children or  it guest?Alma.
wiki	የስሙ ትርጉም የናጋርጁነ ኮረብታ (ቴሉጉኛ፦ ኮርንደ) ነው።	The meaning of his name is, Hill of Nagarjun (Corende)	The name of the name is the Nagarajuna hill (Telugu: Corden).	The height of the meaning of the name unaware (Telugu: corner) of the.
wiki	ቅናት የሚወድን ሰው የሚገልጽ	...that describes a jealous person	Describes someone who is jealous	Imitation of jealousy man
wiki	ዘጸአት 21:28-32፦ በሬ ሰውን ወግቶ ቢገድል፣ በሬው ይወገር፣ ሥጋውም አይበላ።	Exodus 21:28-32 states, if an ox kills a person with its horn, let the ox be bitten, and its meat not eaten.	Exodus 21: 28-32: If an ox kills a man and then the bull is stoned, the flesh is not to be eaten.	Exodus 21:28-32: get Ox in Sigel, your tree, ITER team.
wiki	በቅርብ ጊዜ ግን ኤና-ዳጋን እራሱ የማሪን ንጉሥነት ማዕረግ ያዘ።	Recently, Ena-Dagan, took the throne of Marine by himself.	Recently, however, Ana-Dagan himself assumed the title of Marin.	And but recent-ingusheti and again use the left and right of the student himself.
wiki	የአሜሪካ ፕሬዚዳንት ከአሜሪካ መንግሥት 3ቱ ቅርንጫፎች (ሕግ አውጪው፣ አስፈጻሚው፣ ችሎታዊው) መሀል የ2ኛው ወይም የአስፈጻሚው ቅርንጫፍ ዋና ባለሥልጣን ናቸው።	The president of America, from among the 3 branches of the government (legislator, executor , judge), is a head of the second class or the executor.	The President of the United States is the Chief Executive Officer of the 2 branches of the United States government (the legislature, the executive, the competent).	The 3 branches of the United States the United States (outside of the law, the aspects, ability) or also of the Middle Branch are for today, Mulatu.
wiki	ዘይሴዎች ከእድሜ እና ከፆታ አንፃር የተለያየ የአለባበስ ስርዓት አላቸው።	People of Zeyese have a different clothing style with regards to age and sex.	Zeis have different dresses according to age and sex.	Age and gender in different sites of the dress have system.
wiki	ለገሰ የቀድሞ የመተሃራ፡ የፖሊስነ የመብራት አጥቂ የነበረ ሲሆን በአሁኑ ጊዜ ከኳስ የተገለለ ቢሆንም ከፍተኛ ትምህርቱን ጨርሶ በአዲስ አበባ መብራት ኃይል ባለስልጣን መስራያ ቤት በስፖርት ክለብ ውስጥ በሂሳብ ሰራተኛነት እየሰራ ነው።	Legesse,who used to be a striker for Metehara, Police and Mebrat soccer clubs has retired from soccer, he finished his higher education, and is currently working as an accountant in Addis Ababa's Electric Head Office.	He was a former Meteorological Police Lightning Attackers and has now graduated from the ball but finished his high school career and works as a mathematician at the Sport Club in Addis Ababa.	It is the center of the Kolomna  was the adversary of the police now turn on the high education in Addis Ababa tell the class to turn on the power of music in clubs sports authority financial statements statement of cooperation.
wiki	ወተት በጡት አጥቢ እንስሶች የሚፈጠር ፈሳሽ ነው።	Milk is a liquid produced by mammals.	Milk is a fluid produced by mammals.	Living creatures are not in school to know if the offline mode of alibi.
wiki	መሣሪያቸው የተሰናዳ ፪፻ ሠረገሎችና ፪ ሺሕ ወታደሮች ናቸው።	Weapons are ready for 200 carts and 2000 soldiers.	They are equipped with &quot;chariots and thousands&quot; of soldiers.	2 pergolas bitsindou tools are 2፻ thousands soldiers.
wiki	፲፱፻፳፰ ዓ/ም -ጄሲ ኦዌን የተባለው ጥቁር አሜሪካዊ በበርሊን የናዚ ጀርመን ከተማ በሚካሄደው አሥራ አንደኛው ኦሊምፒክ ውድድር ላይ አራተኛ የወርቅ ኒሻን አሸነፈ።	In 1928, a black american named Jessy Owen, won his fourth gold medal on the 11th Olympic competition hosted im Berlin, city of Nazi's Germany.	ጥቁር--ሲሲ--ጄጄጄጄጄጄጄጄጄጄጄጄጄጄጄጄጄጄጄጄጄጄጄጄጄጄ ጥቁር ጥቁር ጥቁር ጥቁር ጥቁር ጥቁር ጥቁር ጥቁር ጥቁር ጥቁር ጥቁር ጥቁር ጥቁር ጥቁር ጥቁር ጥቁር ጥቁር ጥቁር ጥቁር ጥቁር ጥቁር ጥቁር ጥቁር ጥቁር ጥቁር ጥቁር ጥቁር ጥቁር ጥቁር ጥቁር ጥቁር ጥቁር ጥቁር ጥቁር ጥቁር ጥቁር ጥቁር ጥቁር ጥቁር ጥቁር ጥቁር ጥቁር ጥቁር ጥቁር ጥቁር ጥቁር ጥቁር ጥቁር ጥቁር ጥቁር ጥቁር ጥቁር ጥቁር ጥቁር ጥቁር ጥቁር ጥቁር ጥቁር ጥቁር ጥቁር ጥቁር ጥቁር ጥቁር ጥቁር ጥቁር ጥቁር ጥቁር ጥቁር ጥቁር ጥቁር ጥቁር ጥቁር ጥቁር ጥቁር ጥቁር ጥቁር አራ አራ አራ አራ አራ አራ አራ አራ አራ አራ አራ አራ አራ አራ አራ አራ አራ አራ አራ አራ አራ አራ አራ አራ አራ አራ አራ አራ አራ አራ።።።።።።።።።።።።።።።።።።።።።።።።።።	The ፲9፻፳8/what -Black easy open a boring German city of the United States Senate said the Olympics will be held in the first Fourth of it were twelve Golden Nexans to increase climate resilience.
