Domain	Source Sentence	Reference Translation	Google Translate	Yandex Translate
news	ግዙፎቹ የቻይና ፊልም ስቱዲዮዎች	The large Chinese film studios.	The giant Chinese movie studios	Gestures in china shop
news	የድንች ጭማቂ ለበርካታ ህመሞች ፈውስ!	Potato juice is a cure for many ailments!	Potato juice for many ailments!	Brimstone healing on many homes!
news	ለጤናው ዘርፍ ጥንካሬ የዕቅድ ጉዞው ጅማሬ	The beginning of the planning journey for the strength of the health sector	The beginning of the planning journey for the strength of the health sector	The strength of the plan for Lebanon Jay
news	ኢትዮጵያ በዓለም ሻምፒዮናዎች የሚወክሏትን አትሌቶች ይፋ አደረገች	Ethiopia announced the athletes representing the world champions	Ethiopia announced the athletes representing the world champions	We will have it in the road development sector in Libya imitation
news	”ዘረኝነት ይብቃ ” በሚል መሪ ሀሳብ የቦክስ ውድድር ሊካሄድ ነው	A Boxing Competition is about to take place with the theme "stop racism"	Boxing is about to take place with the theme &quot;Be A Racist&quot;	”Its racism ” is likened the looks of the leaders of the
news	በአዳማ አባ ገዳ “የንጉሡ ነገር” ተስፋ የለውም!	There is no hope for the Aba gaga "King's thing" in Adama	There is no hope of “the King’s thing” in the rapids!	The suspension of the minister “the King's things” hope in!
news	ከስፖርት ዓለም ድንቃድንቅ-አትሌቲክስ	From the sports world Amazing- Athletics	Amazing from the sports world: athletics	Degrading sports world-athletic
news	የፌዴራል ድጎማ በጀትና የጋራ ገቢዎች ክፍፍል ረቂቅ አዋጅ በክልሎች መካከል የበለጠ ግልጽነትና ፍትሐዊነት የሚያሰፍን...	The federal subsidy budget and the Joint Revenue Sharing Proclamation promotes greater transparency and fairness among states....	The federal subsidy budget and the Joint Revenue Sharing Proclamation promotes greater transparency and fairness among states ...	The draft of the federal budget revenue election proclamation Jamieson judiciary in the regions...more
news	የደም ቧንቧ ላይ የሚፈጠር እክልን ለመከላከል	To prevent impairment of the artery	To prevent impairment of the artery	Message icon according to the forest to protect it.
news	በማረሚያ ቤት ያሉ የፖለቲካ ፓርቲዎች አመራሮች ስለመሰረቃቸው ያቀረቡት አቤቱታ አልተቀረፀም ተባለ	The leaders of the political parties in the prison  complaint about their theft was said to have not been filed	The leaders of the political parties in the prison were said to have not made a complaint about their arrest	For the editor, such as the political leadership of the parties in the complaint alteram ስለመሰረቃቸው
news	ስንብትና የትዝታ ኮታ ከአውስትራሊያ	Goodbyes and Memory Quota from Australia	Crash and Memory Quota from Australia	Caustrita than just chat Sintra
news	የፌዴሬሽኑ የምርጫ ጊዜ ዳግመኛ ተራዘመ	The election of the federation was extended again	The re-election period of the federation was extended	The choice of the damage the country in the terrasini
news	በድሬዳዋ አስተዳደር ለ68 ሺህ ህፃናት የፖሊዮ ክትባት ተሰጠ	Polio vaccine was given to 68,000 children in Dire Dawa administration	Polio vaccine was given to 68,000 children in Dire Dawa administration	Boudreau 68 thousand children the immunizations given, is registered at UNESCO
news	የፍቅር ግንኙነታችን ማክተሙን የሚጠቁሙ ጉዳዮች	Issues that mark the end of our romance	Issues that mark the end of our romance	Love and action issues that gentan
news	የቅዱስ ጳውሎስ ሆስፒታል የካንሰርና የልብ ህክምና ማእከል ግንባታ 56 በመቶ ደርሷል	The St. Paul Hospital Cancer and Cardiology Center construction is up 56 percent	The St. Paul Hospital Cancer and Cardiology Center construction is up 56 percent	The medical center of the Cancer Hospital of heart Paul's construction at 56 percent
news	«ሁሉም ሴቶች ለማህፀን በር ካንሰር ተጋላጭ ናቸው»- ሲስተር ፅጌ ተከስተ	All women are at risk for cervical cancer" - Sister Tsige tekeste	&quot;All women are at risk for cervical cancer&quot; - Sister Tsige	"All women are vulnerable to weather and late are a cancer"- these sisters see it
news	ኦኤምኤን በኦሮሚያ የተገኘውን ስኬት ወደ ላቀ ደረጃ ለማድረስ ከክልሉ ሕዝብና መንግሥት ጋር እንዲሰራ ተጠየቀ	The OMN was asked to work with the people and the state to maximize the success of Oromia	The OMM was asked to work with the people and the state to maximize its success in Oromia	The achievements of the foamed their families from the capital to the delivery of it to the people to the work of the kingdom
news	ሴቶችን በማታለል ልቅ የወሲብ ፊልም ያሠራጨው ድረ-ገፅ ባለቤት በኤፍቢአይ እየተፈለገ ነው	The owner of the website, which has made sexually explicit pornography of deceiving women, is being sought by the FBI	The owner of the website, which has made sexually explicit pornography of deceiving women, is being sought by the FBI	Cheating women in pornography is the website apareceu-reiteralm benefit of the owner of the page
news	«የትምህርት ጥራት ጉዳይ የምንጊዜም አጀንዳ መሆኑ አይቀርም»- ዶክተር ሳሙኤል ክፍሌ	“Education quality is always going to be the agenda” - Dr. Samuel kefle	“Education quality is always going to be the agenda” - Dr. Samuel Clay	"The quality of the education agenda አይቀርም Eminem"- that Samuel the
news	በኢትዮጵያ በየዓመቱ 66,000 ሰዎች በካንሰር እንደሚጠቁ ተገለጸ	In Ethiopia, 66,000 people are diagnosed with cancer every year	In Ethiopia, 66,000 people are diagnosed with cancer every year	ተገለጸ 66,000 each year that the cancer of Ethiopia
news	የአሜሪካው የጠፈር ምርምር ተቋም ናሳ ወደ ፀሃይ ሳተላይት አመጠቀ	NASA, the American Space Research Institute, has launched a satellite to the Sun	NASA, the American Space Research Institute, has launched a satellite into the Sun.	The United States Space Research Institute satellite to another as they
news	አኖዝሚያ -የማሽተት ችግር	Anosmia - smelling problem	Anastomia: Anxiety disorder	Anna -the least
news	ምስጉኑ የታክሲ አሽከርካሪ	The Thankful taxi driver	Thankfully the taxi driver	It flashportal the taxi menu
news	ኢንጂነር ኃይሉ ሻውል (1928 – 2009)	Engineer Haileu Shawl (1928 - 2009)	Engineer Haile Shaw (1928 - 2009)	Sale Power Engineering (1928 – 2009)
news	‹‹በዕዳ የተያዘ ሕዝብ››	People in debt	ሕዝብ People in debt	""The company of the people""
news	አዳዲሶቹ አማተሮች ይወለዱ ዘንድ እናምጥ!	Let's wait for the new amateurs to be born!	Let&#39;s wait for the new masters to be born!	Anti Addisons amateurs that title!
news	የአዲስ አበባ ካቢኔ ለዓመታት ቅሬታ ሲቀርብባቸው ለቆዩ ጉዳዮች የመጨረሻ ውሳኔ ሰጠ	The Addis Ababa Cabinet made the final decision on issues that have been complaining over the years	The Addis Ababa Cabinet made the final decision on issues that have been complaining over the years	Through the years Lou Addis Ababa cigarettes Cabine issues given the decision
news	በኦሮሚያና በኢትዮጵያ ሶማሌ ክልሎች መካከል በድጋሚ ያገረሸው ግጭት	Renewed conflict between Oromia and Somali regions	Renewed conflict between Oromia and Somali regions	For the aggressive dispute between the regions in Somalia again
news	ባቲና ሰንበቴ …	Bati and senbete...	Batina and my sabbath…	Pain ...is presente
news	ፈተና ሲርቅ ይቀላል?	Is it easy when there is no temptation?	Is it easier to avoid temptation?	Test sites Ireland?
news	የኩፍኝ ወረርሽኝ በሦስት እጥፍ ጨመረ	The measles outbreaks have tripled	The measles outbreaks have tripled	He added the current three times worse
news	የመክፈቻ ንግግር ጋዜጠኝነት	Opening Speech Journalism	Opening Speech Journalism	Opening speech gazettenet
news	የዋሊያዎቹ ውጤትና የቀጠለው የቁጭት ጩኸት	The result of the waliyas and the continued scream of regrets	The result of the wolves and the continued scream of rage	One scream continued trust of the Italian
news	«ጭምቱ ደራሲ» በቁም ሲዘከሩ	"The quite author" gets praised	&quot;The author of the hymn&quot; is seriously sung	"City author" in soccer
news	ውድድሩ ለክልሎች ብርቱ የቤት ስራ ሰጥቷል	The competition gave hard work to the states	The competition gave hard work to the states	The work has provided the strong Lochloosa home
news	ግጭት እንዲነሳ ተደራጅተው ለሚንቀሳቀሱ ኃይሎች የማይተባበር ህብረተሰብ መፍጠር ተገቢ ነው–ጠቅላይ ምንስትር ዶክተር አብይ	It is proper to create a society that will not work with forces that move in organization to raise disputes. – prime minister Abiy Ahmed	It is right to create a society that does not cooperate with the forces that are organized to cause conflict - Prime Minister Dr. Abay.	The leader of the Endesa to create the appropriate umanitar of Ethiopia–Minister of the Supreme father
news	መከራቸው የበዛው ቦስኒያ የሚገኙ ስደተኞች	Immigrants  troubled in Bosnia	Immigrants in troubled Bosnia	Immigration in Bosnia that the
news	የአዲሱ 5778 ዓመተ ዓለምና 1439 ዓመተ ሒጅራ እንቁጣጣሽ	The New 5778 Anniversary and the 1439  Hijra New Year	The New 5778 Anniversary and the 1439 Year Old Puppet	I am very aware of the new incompetent at 5778 1439 at Amazon
news	ደቡብ አፍሪካዊው አትሌት የታላቁ ሩጫ በኢትዮጵያ እንግዳ ይሆናል	The South African athlete will be a guest on the great run of Ethiopia	South African athlete The Great Run will be a guest in Ethiopia	Athletes, race in South Africa will be a great guest
news	ሰውነት ላይ የሚታዩ የጤና እክል ማስጠንቀቂያዎች	Warnings for physical illnesses	Warnings for physical illnesses	Visible health warnings body who love being fought
news	አፋን ኦሮሞ ተጨማሪ የፌዴራል የስራ ቋንቋ ቢሆን ጠቀሜታው ከፍ ያለ ነው—የኪነ-ጥበብ ባለሙያዎች	If Afan Oromo is an additional federal working language, it is worth it — artists.	If Afon Oromo is an additional federal working language, it is worth it — artists	Oromo federal language have more relevance in the management of high—China-wisdom professionals
news	በጅማ ሙዚየም ለሚገኙ ቅርሶች ተገቢ ጥበቃ እንዲደረግላቸው ተጠየቀ	A call was made to preserve the Heritages in Jimma.	He was asked to give proper protection to the artifacts at the Jimma Museum	Antiques Museum in the appropriate regime of protection to the lidergrup
news	በኢትዮጵያና ቻይና ባህልና ትብብር ማጠናከር ላይ ያተኮረ መጽሃፍ ተመረቀ	A book aiming to strengthen the cultural relation and cooperation of Ethiopia and China has been published.	He inaugurated a book focusing on strengthening culture and cooperation in Ethiopia and China	With the cooperation of the two countries to strengthen the culture and the China itinerary book
news	“ጣጠኛው” እና “አውቶሞቲቭ” መጽሐፍ ዛሬ ይመረቃሉ	The Books " tategnaw" and "Automotive" to be inaugurated today.	The &quot;Fantastic&quot; and &quot;Automotive&quot; book will be inaugurated today	“Materials” and “automotive” book American today
news	በሚሊየን የሚቆጠሩ የትዊተር ተጠቃሚዎች የይለፍ ቃል መጠለፉ ተነገረ	Leaked information shows Millions of twitter users password has been hacked.	Millions of Twitter users are said to be hacking the password	Password of the users smiling uncircumcised also contact us on Twitter
news	ማህበረሰቡ ሰላምን ለማስጠበቅ የድርሻውን እንዲወጣ ተጠየቀ	The community should play its role in keeping peace.	The community was asked to do its part in maintaining peace	Out of the undercount of peace to the community
news	በትናንቱ የኢትዮጵያ ቡና እና የሀዋሳ ከነማ ጨዋታ በተነሳ ረብሻ በሰውና ንብረት ላይ ጉዳት ደረሰ	A damage in personnel and property has been sustained in yesterday’s game between Ethiopian coffee and Hawassa city after a brawl breaks out between the fans.	In the wake of yesterday&#39;s Ethiopia Coffee and Hawassa Kima game, damage to human and property was damaged	The game of the nations have of the country are coffee and the human damage to the property, Rosa
news	የኢትዮጵያ ብሔራዊ ቡድን የሴራሊዮን አቻውን 1ለ0 አሸነፈ	Ethiopian national team won Sierra Leone 1 to 0	Ethiopia&#39;s national team won the Sierra Leone 1-1	The Sierra Leone National to increase climate resilience or an equivalent of it
news	እንግሊዛዊቷ ዶክተር የኢቦላ ምልክት ያሳየች ነርስን ባለማሳወቋ ክስ ተመሠረተባት	A female English doctor has been charged after hiding a nurse with symptoms of the Ebola virus.	The British doctor was charged with not reporting a nurse who showed signs of Ebola	Angelica Ebony the easiest sign of the temperature in Balmacara Norco
news	ከአምስት የስኳር ህሙማን መካከል ሶስቱ በአዕምሮ ጤና ችግር ይሰቃያሉ- ጥናት	A study shows among five diabetic patients three have a Mental health problem.	Three in five diabetics suffer from mental health problems: a study	He said three of the five who's the isocial Health - Study
news	ኢትዮጵያ ኢኮኖሚያዊ ማሻሻያዎችን ከጀመረች ሁለት ዓመት ሊሆናት ነው፤ ከዚህ አንጻር አሁንም በርካታ አሳሳቢ ነገሮችና የሚነሱ ጥያቄዎች አሉ። በእነዚህ ዙሪያ ከጠቅላይ ሚኒስትሩ የኢኮኖሚ አማካሪ ጋር ቆይታ አድርገናል።	It has been two years since Ethiopia started its economic reform, yet there are many critical questions and concerns being raised all the time. We had a discussion with the economic advisor of the prime minister about this issues.	Ethiopia is about to launch two years of economic reforms, and there are still many concerns and questions to be raised. We have spent some time with the Prime Minister&#39;s economic advisor on these issues.	If you started with the economic improvements in the two years in prisoner of fate that have this many questions, but unions said it. These are the supreme in the world of the The Economic to to.
news	የኢሕአዴግና የመድረክ ውዝግብና የፓርቲዎቹ ድርድር	The disagreement between EPRDF and Medrek and the negotiation of the parties.	EPRDF and stage negotiations and parties&#39; negotiations	An account the Virgin the mediation parties
news	ብላክ ሬህኖ በኢትዮጵያ በታዳሽ ሀይል ዘርፍ ለመሰማራት ፍላጎት እንዳለው ገለጸ	Black rhino expressed its interest in working on a renewable energy sector in Ethiopia.	Black Rhino expressed his desire to work in the renewable energy sector in Ethiopia	Place the resin in a desire to take power in Ethiopia said.
news	ብፁዕ ወቅዱስ አቡነ መርቆርዮስ ጎንደር ከተማ ሲገቡ አቀባበል ተደረገላቸው	Saint Abune Merkorios was welcomed when he entered Gondar.	They were greeted as they entered the city of the blessed Saint Abune Mercius Gondar	Allah in the holy city when you የተደረገላቸው Addis Mercurius
news	ቋሚ ኮሚቴው በአየር መዛባት ምክንያት ጉዳት ለደረሰባቸው አካባቢዎች አፋጣኝ ምላሽ ሰጥቷል	The committee responded promptly to areas affected by  global warming.	The Standing Committee responded promptly to areas affected by climate change	The Permanent Committee for the immediate needs of the weather response to damage have been made to the mission commends the Nebe has provided locations
news	'ሶሪያውያን' ስደተኞች የስፖርት ቡድን አባላት በመምሰል ድንበር ሲሻገሩ ግሪክ ውስጥ ተያዙ	Syrian refugees were arrested in Greece while they were trying to pass the border disguised as sports team.	&#39;Syrians&#39; refugees were arrested in Greece as they crossed the border, pretending to be members of a sports team	'Cooling' of members of the Greek sports team in the group stage remember
news	የኪነ ጥበብ ሽልማት	Art Awards	Art Award	The wisdom of China
news	በጉጂ ዞን ከ244 ሺ ለሚበልጡ ህጻናት የፖሊዮ በሽታ መከላከያ ክትባት ተሰጠ	more than 244 thousand children were given a polio vaccine in the Guji zone.	Polio vaccine was given to more than 244,000 children in Guji Zone	Though, he added 244 thousand children registered at UNESCO to the protection given disease vaccinations
news	የለውጡን ቀጣይነት ለማረጋገጥ ለሰላም ትኩረት መስጠት ይገባል- ታዋቂ ግለሰቦች	Peace must be ensured to maintain the continuity of the change, prominent individuals.	Peace must be emphasized to ensure continuity of change - prominent individuals	The focus of the forum is to ensure peace in the Love - popular individuals
news	የብብት ጠረንን መልካም ለማድረግ የሚጠቅሙ ምክሮች	Tips to remove underarm body odor.	Tips to make a ponytail good	The interest to been to do not as good
news	ከፌስቡክ ገፅዎ ላይ ሊያስወግዷቸው የሚፈልጓቸው 10 ነገሮች	Ten things you should remove from your facebook page.	Here are 10 things you want to remove from your Facebook page	For your friends on Facebook to list 10 things that you want
news	አድዋን በማስመልከት በሰሜን ሸዋ የተለያዩ አካባቢዎች ጉብኝት እየተካሄደ ነው	Inspired by the Adwa victory, tours and visits are being held in various towns of north shoa.	Referring to Adwa, a tour of different areas of North Shoa is under way	Beastiality said that the said part of the interview for different locations of North Shewa
news	ምርት ገበያ በአዲሱ የግብይት ሥርዓት ከአንድ ቢሊዮን ብር በላይ ዋጋ ያወጡ ምርቶችን አገበያየ	Ethiopia commodity traded commodities worth a billion birr under a new trading system.	Commodity Market has traded products worth over one billion birr in the new trading system	One of the new production system of the transaction and the market price of the products
news	“ኢዮሃ ሲኒማ” ነገ “ቀይሥሮች” መጽሐፍ ማክሰኞ ይመረቃሉ	The book “ eyoha cinema” to be inaugurated tomorrow, the book ” keysiroch” will be published Tuesday.	&quot;Joha Cinema&quot; book &quot;The Red Ones&quot; will open on Tuesday	“Cinema alone” ነገዎ “cities” American Book Tuesday
news	በ14ኛው ሳምንት የፕሪሚየር ሊግ መርሃ ግብር መቀሌ ከተማና አርባምንጭ አሸነፉ	In the 14th week of Ethiopian premier league schedule, Mekelle city and Arba minch city managed to gain victory.	In the 14th week, Premier League champions Mekele and City won the title	AUEOM notes that the week began cross the city of Addis አሸነፉም tax etc
news	በደቡብ ክልል የደረሰ ሰብልን ፈጥኖ ለመሰብሰብ ድጋፍ እንደሚያስፈልግ ተገለጸ	A call was made to support the harvesting of grown crops readly in the southern region.	It was announced that support was needed to quickly harvest crops in the South	We got a crop in the south, and many people who support ፈጥኖ ተገለጸ
news	ፌስቡክ በተንቀሳቃሽ ምስል የመልካም ልደት ምኞት መግለጫ የምናስተላልፍበት መተግበሪያ እያስተዋወቀ ነው	Facebook is introducing an application for birth days wishes.	Facebook is introducing an app for us to convey a birthday wishes wishlist	Image description Facebook on your mobile device iminostilbene not the worst play of the birth of elastomer
news	ወደ ጤና ተቋም መሄድ ሳያስፈልገን የስኳር በሽታን ለመከታተል የሚያስችልው መሳሪያ	A device which will allow you to monitor diabetes without going to the health facility.	A tool to track diabetes without having to go to a health facility	Disease to the health institute to go to the device's follow-up to ceasefire
news	በዓለም ዙሪያ በታዳጊዎች ላይ ከሚከሰት ሞት የትራፊክ አደጋ ቀዳሚውን ስፍራ ይይዛል ተባለ	A study shows Traffic accidents are the major source of deaths of teenagers globally.	It is said that traffic accidents are the leading cause of death among teens worldwide	Developing countries in the world in traffic death if it appear a place ይይዛል
news	ከጋዜጣ አዟሪነት እስከ ፊልም አከፋፋይነት	From selling newspapers to distributing movies.	From journalism to film distribution	Acetate to the authority in a newspaper
news	ፌዴሬሽኑ 5 ተጫዋቾች ላይ የቅጣት ውሳኔዎችን አሳለፈ	The federation passed a penalty on five players.	The federation passed penalties on 5 players	5 the country in the decisions and the punishment for these players
news	ኃይሌ ገብረስላሴ ከአትሌቲክስ ህይወት በኋላ	Haile Gebreselassie after his athletics carrier	Haile Gebreselassie after athletic life	The power of life after the Beatles Gebreselassie
news	በድሬዳዋ አስተዳደር ለ68 ሺህ ህፃናት የፖሊዮ ክትባት ተሰጠ	Polio vaccine was given to 68,000 children in Dire Dawa administration	Polio vaccine was given to 68,000 children in Dire Dawa administration	Boudreau 68 thousand children the immunizations given, is registered at UNESCO
news	ውድድሩ ለክልሎች ብርቱ የቤት ስራ ሰጥቷል	The competition gave hard work to the states	The competition gave hard work to the states	The work has provided the strong Lochloosa home
news	ቮልቮ በኤሌክትሪክ የሚሠሩ መኪናዎችን በ2019 ለገበያ እንደሚያቀርብ አስታወቀ	Volvo has announced that they will be releasing cars that run on electric in 2015 in the markets.	Volvo announced that it will market electric cars by 2019	Tesla electric car for market to 2019 if a turned on by said.
news	አንበሳ ባንክ ዝቅተኛ ዕድገት ያሳየበትን የ351 ሚሊዮን ብር ትርፍ አስመዘገበ	Anbesa Bank least growth of 351 Milliom ETB profit recorded	Lion Bank posted a profit of 351 million birr, showing a low growth rate	Lion 351 million low bank profit growth, Asafu format
news	ካስትል ወይን አዲስ ምርት ለገበያ አቀረበ	Castel Wine has produced a new product to the market.	Castell Wine has marketed a new product	The new product wine in YaST to Algiers
wiki	በ1930ወቹ መጨረሻ ላይ አንድ-አምስተኛ (20%) የሚሆኑት የአገሬው ሰዎች በከተማ ይኖሩ ነበር።	By the end of the 1930s, about one-fifth of the country’s population were urban dwellers.	By the end of the 1930s, one-fifth (20%) of the local population lived in the city.	At the end of the beach one-fifth (20%) of the city that was free will.
wiki	ከ1957 ዓም ጀምሮ ጆንሰን ብዙ የአሜሪካ ወጣት ልጆች ወደ ሥራዊት በግዴታ ምዝገባ አስገብቶ ወደ ቬትናም ጦርነት ይላኩ ነበር።	Starting from 1957, Johnson forcibly inscribed many American youth into the military and were sent to the Vietnam War.	Beginning in 1957, Johnson, many American teenagers, had been forced into the work force and sent to the Vietnam War.	1957 Johnson ዓም young children to the many obligations of the United States to the Vietnam War and it was open. subscriptions.
wiki	ሆኖም ግን ከሌሎች እስረኞች በተለየ መልኩ በግራኝ አህመድ ሚስት በድል ወምበሬ እንደተያዘ ታሪክ ያትታል።	However, in a manner different from other prisoners, he was captured in Dil Wonbere by the wife of Gragn Ahmed, as history reiterates.	However, the story goes that he was captured by the victorious wife of the late Ahmed, unlike the other prisoners.	However, the other prisoners began in the history of the victory of Tartu member attach his wife.
wiki	ከአንዲት ሴት ልጅ ሌላ ወራሽየለኝም።	“I have no heir, except for one daughter”	I have no other heir than one daughter.	Version from one of the other women.
wiki	እንደሚናገረው ከሆነ ይሔ ዕድገትም የተገኘውና እዚህ መድረስ የተቻለው በዱሮ ሙዚቀኞች መስዋዕትነት ነው፡፡	According to accounts, this growth was achieved and brought this far through the sacrifices of past musicians.	According to him, this growth was made possible by the sacrifice of old musicians.	The growth of the lingerie here, if possible before the access of the notices of sacrifice
